,title,selftext,subreddit,created_utc,author,num_comments,score,is_self,timestamp
301,Why are the AIR MAX 270 'LIGHT BONE/HOT PUNCH so much more expensive?,"I'm not really a sneaker head and came here to ask why this color way is so much more expensive than the others.  They are hard to find and I only find them for $250 and up.  I'm trying to buy these I like this color the best.

&amp;#x200B;

Thanks",Nike,1552011828,djdubrock,1,1,True,2019-03-07
303,Nike SB hoodie fit,"Hi r/Nike

&amp;#x200B;

Im looking to buy this nike SB hoodie and was wondering how it fit.

Im around 6""3 95kg and usually wear a XL or XXL and would pick the XXL but cant find one. Would an XL fit in the Nike sizing?",Nike,1552031591,farzmonkey,0,1,True,2019-03-08
309,Has this happened to anyone's metcon 3/4 heel clip?,"[Heel Clip Color Peel](https://imgur.com/a/Y0NYqf7)  

Just wondering if this has happened to anyone else - I haven't seen any record of it online. I was under the impression the heel clip was solid color+material, not some thin coating for the color. There is a textural difference between the coating and the tpu material.",Nike,1552070904,EliTheAsianGuy,0,1,True,2019-03-08
312,To What Extent Can Footwear Technology Go Before Hitting A Tech/Creative Wall?,"Wasn’t sure where to post this, but because I own Nike Soccer Cleats, Jordan basketball Shoes, and Baur Hockey Skates I’ve always wondered when will athletic tech hit a wall? And so here I am Nike.

I walked through the basketball section of my local sports store and noticed how utterly ugly basketball shoes have gotten with no obvious tech upgrades. I’ve been out of school for 3 years now thus never having a need to go out and buy new cleats or shoes to replace my worn footwear. I remember the Hyperfuse material, Nike Flywire tech, Flyknit, the bags of air etc and how truly revolutionary all of it was.

I own 2 pairs of Nike hyper dunk 2012 (low and a high), and hyper dunks 14-15 high and 16 low (in my opinion the 2012 hyperdunk low is by far the greatest hyperdunk yet, nothing about it from traction, upper quality and stitching, weight, fit, or aesthetic etc is flawed). I own Jordans 28-30 all of which are absolutely fantastic shoes, and revolutionary in their own regards (maybe not the 30 but the 28 and 29 for sure). I own magistas, and mercurials top of the line for their respective year, I own multiple vapours for football and just recently replaced my old hockey skates with top of the line baur nexus 1n skates. 

I look at all of these footwear and I can’t help but feel like we’re peaking in terms of tech. Maybe not so much hockey skates, but the tech being used on football cleats, soccer cleats and basketball shoes are almost a decade old. Basketball shoes are hideous now a days with no new tech. Like in what way can you improve on the Jordan 29? That shoe was perfect! How could you possible beat a fully flyknit upper? The traction was absolutely ridiculous and the rigidity was perfect. I can’t help but feel Nike and other sports companies are trying desperately to save and spread out old tech because the sports wear industry has peaked tech wise.

",Nike,1552102585,LebronJamesGames,1,2,True,2019-03-08
318,Looking for a summer shoe that will break necks. The Off-White Zoom Fly or the Element 87 Royal Tints?,,Nike,1552145688,FinnT530,0,1,True,2019-03-09
320,Future vs Normal?,Is there a difference between air max 270 and air max 270 futuras practically?  Is it just a different style or a different actual shoe?,Nike,1552149189,TeenagersAccount452,0,1,True,2019-03-09
329,I can not recommend Nike Vapormax’s enough.,That’s it. That’s the post.,Nike,1552189263,tapwaterbread,7,0,True,2019-03-09
335,Help me find this please,"Posted Feb 2019. Kimpembe of PSG wearing it. Can't find anywhere

&amp;#x200B;

[https://www.instagram.com/p/BuZlEVHAzpI/?fbclid=IwAR1\_FYD4Gg883RFhR0lb0uIRwkv-NvXB9I52TbaTOW4klHx5X0oxO71AAdc](https://www.instagram.com/p/BuZlEVHAzpI/?fbclid=IwAR1_FYD4Gg883RFhR0lb0uIRwkv-NvXB9I52TbaTOW4klHx5X0oxO71AAdc)",Nike,1552231611,jellythree,0,0,True,2019-03-10
341,Restock for Air Max 97 Plus,Does anybody know a date when nike restocks the air max 97 plus AH8144-101? ,Nike,1552260299,-backd00r,0,1,True,2019-03-10
343,Nike air force 1 swoosh pack b grade,I am trying to buy some nike air force 1 swoosh pack shoes and came across a person who is selling them and claims the shoes are b grade. So my question is does anyone know if any b grade shoes of this type have ever been released?,Nike,1552302408,brandyyy29,0,2,True,2019-03-11
346,AF1 - Black upper / Orange swoosh?,I'm sure this colorway happened at some point. Any info?,Nike,1552327638,calKno,1,1,True,2019-03-11
350,Pairing problem with Adapt BB,"I use a Galaxy Note 9 &amp; I just got the Adapt BB &amp; it says it's already paired to a device. They work normally but I can't connect them with my phone,anyone with similar issue or found a fix? ",Nike,1552348668,necondaa,5,1,True,2019-03-11
354,Nike Tech Fleece Sizing,So I’m 6’3” (191 cm) and around 185 lb (84 lg). What size should I get for my Nike Tech Fleece pants?,Nike,1552369699,KingTuoyo,4,1,True,2019-03-12
357,Anyone know when Nike ID Regular Air Force 1 Lows will be back in stock?,I’ve had some customs made for the last few months but they are out of stock and there’s no option to be notified when they’re back?,Nike,1552388639,trn23,2,1,True,2019-03-12
360,DO NOT PURCHASE EARL BB SNEAKERS,The firmware update bricked my shoes and Nike is refusing to service or repair them because they are from a third party retailer.  I just spent over 2 weeks talking to reps trying to solve the issue and they hung me out to dry on their $350 new tech.  They do not care about their customers,Nike,1552404495,RJPeaches,2,5,True,2019-03-12
366,Off white prestos (white),"I have size 8 looking for 9.5
Hit me up if you got em ",Nike,1552444603,Atltyrant,3,1,True,2019-03-12
368,Help: Looking for these Nikes right here,[https://i.imgur.com/C7P0zxc.png](https://i.imgur.com/C7P0zxc.png),Nike,1552447522,Resh121,2,2,True,2019-03-12
369,So I want to buy white Nike Airforce 1 low tops for men but I need help with my body type.,"So I have noticed from seeing countless youth today wearing airforce 1’s that they tend to look much nicer on smaller feet. My feet however, tend to look larger than they are because my ankles are EXTREMELY skinny yet my feet are lengthy. I wear a size 10.5 US in Kobe’s outdoor basketball sneakers. My question is, if I get a size 9 in airforce 1, which is small for me, will that be ok for my feet and look good ",Nike,1552489633,SammyJoon,4,0,True,2019-03-13
372,2018 Free Run/RN Flyknit insole doesn't fit/too small,"Hi just ordered a pair of these from Nike.com. When I put them on, I noticed my left and right feet didn't feel the same. Upon closer inspection the insole positioning was different on the shoes. Lengthwise, they fit. However, the insoles have space to shift left and right inside the shoes by as much as half an inch.

&amp;#x200B;

I own many pairs of Nikes and I know this isn't normal. I have Metcon 4's, 2016 Free Run Flyknits, 2016 Free RN regular. This doesn't happen on any of my other shoes.

&amp;#x200B;

I also contacted Nike Customer Support twice. They just kept repeating ""the insole is designed to come in and out"" and wouldn't address the issue of the insole being too narrow for the shoe. I then asked if it was possible the wrong size insole was put into the shoe and they both said ""No."" 

&amp;#x200B;

Anyone share a similar experience? I have a really hard time believing the insole is supposed to have space to shift laterally in the shoe.",Nike,1552498953,SuperSayYam,1,1,True,2019-03-13
373,Dissertation Help!! About Kaepernick and Nike.,"Hello Guys!

I'm Edward, a MA candidate currently studying Public Relations &amp; Corporate Communications. I'm researching the ethical, economical, and political management of Nike's controversial ad which featured Colin Kaepernick and taking a stand on societal issue. This is for my dissertation and I need at least 200 responses.

Here is the survey link:[https://nyu.qualtrics.com/jfe/form/SV\_0uqXXluoobcDiCx](https://nyu.qualtrics.com/jfe/form/SV_0uqXXluoobcDiCx)

PLEASE help this poor student who is stuck in the library in this beautiful sunshine day!!! THANK YOU SO MUCH.",Nike,1552507678,edwary,1,1,True,2019-03-13
375,"I was just wondering, would Jordan 1's make a good skate shoe?","Curiosity just struck me cause I was debating on what kind of skate shoe to get before the snow melts, DC Pensford has grown on me but I was thinking if maybe Jordans would make good as well. Your answer is greatly appreciated.",Nike,1552519179,flyingj3di1907,6,2,True,2019-03-13
376,What Shoes are These?,"Hello all,

&amp;#x200B;

My mother bought a pair of these nikes (picture is attached) and she wants another pair. However, we can't seem to figure out the name of the shoe. I've tried searching, and I can't find anything. They slightly look like roshes, but they're not. Also, their use to be a tag inside the shoe, however, the text is faded away from her foot sliding across it.

&amp;#x200B;

Thanks in advance!

&amp;#x200B;

HERE IS PICTURE OF SHOE:  [https://gyazo.com/bc74c820be4f403c7c0251bd6d5e57ab](https://gyazo.com/bc74c820be4f403c7c0251bd6d5e57ab) ",Nike,1552522812,LTX_Devin,2,1,True,2019-03-13
378,Anyone Know What the Best Nike’s to wear for flat footed people?,I keep getting calluses on my toes and I need to know what the best Nike’s are for flat footed individuals. I am a size 11 Men’s.,Nike,1552546846,BobeKrown,9,1,True,2019-03-14
379,ARE YOU A FAN OF NIKE?,"Then kindly fill this survey on Consumer Engagement of Nike through Instagram/Snapchat Stories!

[https://goo.gl/forms/G2FYvYwWPdQODLie2](https://goo.gl/forms/G2FYvYwWPdQODLie2)

Thankyou!",Nike,1552563383,anushreesen93,0,0,True,2019-03-14
383,Discontinued: Nike Dry Knit Dri-Fit Ultimate Training Pants? Closest current product?,"I own a pair and love training in them, but it seems Nike doesn't make this particular version any more. https://photo3.i-run.fr/nike-pantalon-ultimate-dry-knit-m-vetements-homme-111437-1-f.jpg

What is their closest currently produced product? Their ""yoga"" pants seem similar.

I like the waistband, don't use the drawstrings that much, and ankle bands are a must, but the ankle zippers are not. The biggest draw is the lightweight material. But I can't make up and down of what dri-fit is and is not? For example some fleece pants are also advertised as dry-fit, so I'm guessing the knit material is what I'm looking for?

Any and all help identifying is appreciated.",Nike,1552582610,agaetliga,0,1,True,2019-03-14
385,How much are Nike windbreakers,I want to buy one from a store in the mall how much do you think they’ll be? ,Nike,1552593529,hyper_acid,2,2,True,2019-03-14
387,Where can I buy the Air Force 1 OG Team Red?,,Nike,1552599203,vSloshyy,0,1,True,2019-03-14
393,Hello all. I was curious are the PG3’s or Kyrie 5’s a good fit for someone with a wider foot?,I’ve got wide feet. Size 12. I’m recently starting to play basketball again at my gym. That’s what I would be using them for or the occasional personal wear. I was looking at either those or Lebron 15’s. ,Nike,1552627623,Jorel7521,1,1,True,2019-03-15
394,Any know about sizing for the airmax 97 bw,,Nike,1552628272,gayforgod21,1,2,True,2019-03-15
402,Looking to buy all white shoes (Ebernon maybe?),"Hi, I have been wanting to get white Nike's for a while now. I first thought about getting Air Force 1 but they are a bit too expensive for me so I found a model called Ebernon which I also find really nice looking, haven't seen many people talking about them though. What do you think about those? ",Nike,1552682836,Goni90,10,1,True,2019-03-15
403,I can't decide between Nike Ebernon Mid and Ebernon Low,"The summer is coming, and I'm afraid Ebernon Mid will be too warm for high temperatures, but I reallly prefer their look over Ebernon Low. Do any of you have them to tell me if they're okay to have them at summer time or it's complete stupidity?",Nike,1552683579,Diksur,0,1,True,2019-03-15
405,HELP ME Nike air force (?) 1990 ~ Never used,"I was able to get my hands on these shoes for 10$ they have been sitting in a box for 30~ years as ive been told never worn... i cant seem to find these shoes anywhere what are they and whats their value?
https://m.imgur.com/a/gEUzt6p",Nike,1552685031,Qwerty9611179,1,1,True,2019-03-15
411,Can anyone tell me what hoodie Kyrie is wearing in this video?,"I like the look of this hoodie and was curious if it's available somewhere. Thanks!  

[https://www.youtube.com/watch?v=4dr44npSoKE](https://www.youtube.com/watch?v=4dr44npSoKE)",Nike,1552714786,Gsw-,0,1,True,2019-03-16
413,What type of Nike hoodie is Kyrie wearing in these screenshots?," [Here's a couple screenshots](https://i.imgur.com/Kgy6KU5.jpg) of Kyrie wearing this hoodie. I love the look of it, just curious what type it is. Thanks for help!",Nike,1552723715,Gsw-,2,1,True,2019-03-16
414,Help ID'ing Shoes,"Hello, just wondering if anyone could help me ID these. Thanks!

https://i.redd.it/xv24obdsvgm21.jpg

https://i.redd.it/iljswejqvgm21.png",Nike,1552736019,dannycourage,0,1,True,2019-03-16
417,I have a 95$ Nike egift card/ digital gift card for sale. Asking for 65$-70$ Paypal. If intrested PM me Asap,I bought the 95$ Nike e gift card today from Amazon then realized I don't need it. If someones once to reach an agreement Ill forward the digital gift card to whoever will purchase it. Thanks!,Nike,1552754306,RichieF21,2,1,True,2019-03-16
419,how am I supposed to clean Nike SB Nyjah(s)?,,Nike,1552758589,theliciaman,2,1,True,2019-03-16
422,Buying shoes,I'm thinking of changing my shoes and I want to try Nike and I'm looking for a comfortable/budget friendly/good looking shoe for using daily and do some running ,Nike,1552772875,MrPtato2,5,1,True,2019-03-16
423,Buying shoes.,"I'm thinking of buying some Nike shoes and I want one that is nice looking (I like those that have a high sole), budget friendly and comfortable for using daily and for some running.",Nike,1552773851,MrPtato2,2,2,True,2019-03-16
426,Dose anyone know what these shoes are called?,"&amp;#x200B;

*Processing img 0oxjn2qcpkm21...*",Nike,1552782795,jack__joh,2,2,True,2019-03-16
427,Two giant together,"&amp;#x200B;

*Processing img a8stnumi6nm21...*

*Processing img r8kzlsmi6nm21...*

*Processing img r17z8ypf6nm21...*

*Processing img 8zpg66qf6nm21...*

visit the source:[U/jillianaa1234](https://www.reddit.com/user/jillianaa1234)",Nike,1552812343,bahare1234,0,1,True,2019-03-17
428,What do you think about NIKE INSTAGRAM STORIES! Let us know! Please fill it!,"Kindly fill it -

[https://goo.gl/forms/RP0cTH6jpJygDpnQ2](https://goo.gl/forms/RP0cTH6jpJygDpnQ2)",Nike,1552815526,anushreesen93,0,1,True,2019-03-17
431,How can I paint the red in my Lebron 16s black?,"Would I use this maybe?  [https://www.amazon.com/Angelus-Acrylic-Paints-1oz-001/dp/B00HQ5MNW0/ref=pd\_sbs\_201\_14?\_encoding=UTF8&amp;pd\_rd\_i=B00HQ5MNW0&amp;pd\_rd\_r=8b4e76a4-48e0-11e9-97b0-73c3e6ce26b1&amp;pd\_rd\_w=0zhxt&amp;pd\_rd\_wg=PIoKe&amp;pf\_rd\_p=588939de-d3f8-42f1-a3d8-d556eae5797d&amp;pf\_rd\_r=SXS883FBEJG488N075H1&amp;psc=1&amp;refRID=SXS883FBEJG488N075H1](https://www.amazon.com/Angelus-Acrylic-Paints-1oz-001/dp/B00HQ5MNW0/ref=pd_sbs_201_14?_encoding=UTF8&amp;pd_rd_i=B00HQ5MNW0&amp;pd_rd_r=8b4e76a4-48e0-11e9-97b0-73c3e6ce26b1&amp;pd_rd_w=0zhxt&amp;pd_rd_wg=PIoKe&amp;pf_rd_p=588939de-d3f8-42f1-a3d8-d556eae5797d&amp;pf_rd_r=SXS883FBEJG488N075H1&amp;psc=1&amp;refRID=SXS883FBEJG488N075H1)

[Here are the shoes](https://i.redd.it/zjjz51nu0qm21.jpg)",Nike,1552846722,Curious_George_Asks,2,2,True,2019-03-17
432,What shoes are these?,"[https://imgur.com/0otg7sn](https://imgur.com/0otg7sn)

[https://imgur.com/OUDNEkw](https://imgur.com/OUDNEkw)

&amp;#x200B;

Saw these on OfferUp but its the wrong size.",Nike,1552848258,steven4297,1,0,True,2019-03-17
435,I need help choosing sneakers!,"Hey, so i got 150USD$ and i need help choosing some good Nike sneakers, i am having a hard time so i would like to see what people think!",Nike,1552855916,KopalaTheSilver,5,1,True,2019-03-17
438,Which shoes are good to fit custom orthotics?,I’m looking to get some shoes but I have custom orthotics and I’m not sure which ones would fit them okay and not be too tight or uncomfortable? I was looking at the air max 270 flyknit in particular because I’ve read good things about them. Would these be good or something else perhaps? ,Nike,1552872181,Starkiller808,2,2,True,2019-03-17
444,OPINIONS: Nike Vapormax plus or Nike React element 55,"Okay so I'm not broke but I dont exactly have enough money atm being a student to buy the nike react element 87s. I want opinions on what would be the best shoes to buy because I love the design on both. 

NIKE IRIDECENSE VAPORMAX PLUS, literally cool as fuck with the colour fade looking like purple sometimes and grey sometimes depending on what angle and what light you look at them in and can be a very stylish shoe to wear especially where I'm from where I think roadman shoes look sick. But it has a very bulky silhouette compared to the Nike react which looks a lot smoother and will go with a lot more clothes.

NIKE REACT ELEMENT 55: not sure what colour way I want yet but the silhouette and the detail is just phenomenal and the shoes are so intresting to match with clothes. However the colourways for the 55s suuuuck and genuinely makes me contemplate how I'll even wear them with clothes because I feel like the colour ways just dont do enough to promote the little and beautiful details",Nike,1552930949,drnkthadrip69,2,2,True,2019-03-18
447,HELP ME FIND THIS SWEATER,A Crossfitter posted a photo of this dope Nike sweatshirt back in September and I can't find it for the life of me. I heard the reddit community is more efficient than the CIA so I thought I'd reach out for help....,Nike,1552943916,pinkvitamingummies,2,2,True,2019-03-18
454,Nike Employee AMA,Been with the company for sometime now and would love to answer some of your guys questions! Little bit of background I work in the retail stores. I’d love to answer any questions you all have about the company!,Nike,1552955040,OculosChris3,17,4,True,2019-03-18
456,Really disappointed in the quality of the lifestyle shoes recently,"Been a lifelong Nike customer and this past year has been a headache. I've had two different Airmax 270 pairs develop holes with them after 1 month and a pair of VaporMax' with a defective sole insert, making it uncomfortable to walk in.

Tired of exchanging shoes all the time. What gives?",Nike,1552964772,RottenKodiak,0,2,True,2019-03-18
460,Nike zoom GTS,"Hello,

I really like these sneakers, but i cant find a place to buy them. Will they be available soon?
Or is it limited collection? Thanks",Nike,1552997910,Alcuss,0,2,True,2019-03-19
466,Outfit ideas for Purple PG’s?,"I have a pair of purple PG’s but I’m having some trouble building an outfit around them. I was thinking of wearing them with jeans, but I don’t know what to wear for a top. Any ideas as to what colors would go well with them? Thanks!",Nike,1553017239,gamesandblurays08,0,1,True,2019-03-19
468,Air max Throwback Future resell,"I was thinking about the new Throwback Future pack will have a high resell price, because is a limited edition of this shoes what you think about it?",Nike,1553026156,PaumCumrquena,0,2,True,2019-03-19
473,Nike Socks,"I went to Dicks today to get some dri fit socks, the ones with left and right specific socks. They didn’t have any and neither did academy. Did Nike discontinue the left and right socks?",Nike,1553049800,potatoesassholes,3,1,True,2019-03-19
474,Can I use the Adapt android app yet?,This is like my 3rd time asking this sub for help but I have one last question. Is it safe to pair my shoes with the Note 8 yet? I still haven't done it even a month after release.,Nike,1553053775,Akira_Kurusu_P5D,0,2,True,2019-03-19
476,Deflated Air Max,"Around a year ago I got some [Air Max Sequent 3s](https://www.famousfootwear.com/Mobile/ProductDetail.aspx?p=70632). I’ve worn them very often almost all year, and now the air chamber(?) in the back is deflated and squeaky. Is there any good fix for this? ",Nike,1553063834,Shail_,4,1,True,2019-03-20
477,"Can you use the LeBron Soldier XII's as normal sneakers? They look fire, but they're basketball shoes. And i'm worried they wear out really quick on the pavement etc.","&amp;#x200B;

https://i.redd.it/5yplu3enh9n21.png",Nike,1553082412,itsyaboifabian,2,4,True,2019-03-20
481,Anyone know more about this Vintage Varsity Jacket?,"Hello,

&amp;#x200B;

This Nike Varsity Jacket is in my possession, but I've been scouring the internet and struggling to learn more about it.

&amp;#x200B;

Does anyone know what year this is from?

The name of this jacket and is it worth anything?

&amp;#x200B;

https://i.redd.it/9uxmd731rbn21.jpg

Thank you for your help.

&amp;#x200B;

backside: [https://imgur.com/a/w10Wg](https://imgur.com/a/w10Wg)",Nike,1553109717,perhapssergio,2,3,True,2019-03-20
482,Red Nike strap shoes with over branding?,I saw a guy wearing red nuke shoes with big straps on them that said Nike. They had Nike in them like 3-5 times. Any idea what they were?,Nike,1553116415,brentbyington,1,3,True,2019-03-20
483,Year old air max 97 squeaking,"hiya, ive had my 97s for about a year now and i think that the sole has been worn down from the front as i can literally feel the bubble and it makes a horrible noise when i walk

&amp;#x200B;

i've tries taking out the insoles but i get as far as a white layer of cloth and dont know how to remove it further or stop the squeaking - it sucks that the shoes only last a year considering they were £150!!",Nike,1553120197,sfaraj,9,2,True,2019-03-20
486,Does anyone know which lines of Nike sneaker have the logo as the same color as the shoe?,I am trying to ID a pair of pink Nike sneakers. All I can remember is the Nike logo on the side was not fully visible bc it was pink too. The bottom part was white and the shoe was fairly simple. Just straight up pink. Does anyone have an idea? Seemed like a lightweight sneaker too.,Nike,1553141181,graysonfio,2,2,True,2019-03-21
490,Sizing on Air Max Thea,"What size you recommend? 
In Chucks I have a 7 / 40 ",Nike,1553189210,Nomad-Scorpion,1,1,True,2019-03-21
491,Counterfit nike product in a nike store,"So in my country (in cis) there is a official nike shop supplied by nike, i have noticed fake jordans, low quality vapormax and other shoes that are really bad quality for nike, clothes and everything else is legit, my question is what can i do or if i can do anything.",Nike,1553197662,KopalaTheSilver,3,2,True,2019-03-21
493,Replacement vapormax 2019 black laces?,If anyone has looked into this or could point me in the right direction I would GREATLY appreciate it. Thanks,Nike,1553208782,BlackIce967,0,1,True,2019-03-21
495,HELP ME OUT!!!!!,"I’m looking for Nike running type sneakers. They were popular around the 2010 era. They are mostly white and black. The sole had the shape of the nike lunarlon and was VOLT color. There was some black coloring on the heel. I have a few pictures of what comes closest in resembling them!!!!! 
",Nike,1553214697,tbiev,6,1,True,2019-03-21
496,Nike Epic React Laces?,"I am looking for a place to purchase shoe laces for the Nike Epic React Flyknits. Does anyone have somewhere they recommend?

Also, I am in the market for the same type that come with the shoes. Is there a certain type I should be looking for? Thanks!",Nike,1553215471,Brown_Sandals,0,1,True,2019-03-21
498,Mystery Pair of Nikes,"So I was at my local Nike Clearance Store and they had a pair of sneaks that I cannot find anywhere, though I don't remember the name of them. They were very similar to the CMTR 2018 and the Pocket Knife but not exactly. They were red/maroon sneakers (in a red box) and I think the bottom sole was gum. Please help!",Nike,1553218405,wearethedennis,0,1,True,2019-03-21
1,Anyone have an effective method of getting stains out of Nike Tech?,,Nike,1547486691,gutkassidy,5,1,True,2019-01-14
2,Do you need to add a payment method to your account to enter a draw on SNEAKRS app?,"Draw is tomorrow, just wondering if it's necessary to add a payment method to my account? I plan on using 2 accounts so that's why I'm asking",Nike,1547491321,Seppecx,1,1,True,2019-01-14
4,Shirt identification,"I need to find product code or model name of that shirt Kobe is wearing... (source: [https://www.instagram.com/p/BnHIISaFPue/](https://www.instagram.com/p/BnHIISaFPue/))

*Processing img qvgsqg1t6ha21...*",Nike,1547509617,vuk20121,0,1,True,2019-01-14
8,Get 6% cash back on Nike purchases!,"6% cash back on every purchase from the Nike website. Get your $10 welcome bonus if you haven’t joined befrugal!
https://www.befrugal.com/rs/VWYYLCC/",Nike,1547539185,Lc10555,1,1,True,2019-01-15
21,What does it all mean Basil?,Does anyone know what the numbers 14 09 11 05 on the new tech pack are? It’s kind of driving me crazy and I don’t know why,Nike,1547646461,whodat420,2,1,True,2019-01-16
26,Shoes Similar to....,Looking for shoes similar to fit and look of the black 2015 airmax ...any recommendations would be great! ,Nike,1547672914,zack7891,1,1,True,2019-01-16
33,Stressing about if the pair of off white 90s I bought is legit,"They are the ones in this link https://solecollector.com/news/2019/01/off-white-nike-air-max-90-desert-ore-aa7293-200-release-date.

I have box and everything. I see them selling on stock x as well. How is this possible?",Nike,1547695102,BananaPeelSlippers,5,1,True,2019-01-16
39,Want to sell $250 Nike card for $200 PayPal,Pm me or mods delete if not allowed. ,Nike,1547738641,bigploop,0,1,True,2019-01-17
