,title,selftext,subreddit,created_utc,author,num_comments,score,is_self,timestamp
125,Will the nike sb x jordan 1 release on the SNKRS app?,I have no skate shops near me and i really want these shoes,Nike,1557196155,StingKing,0,1,True,2019-05-06
126,Anyone here work for Nike that can give me some tips? Incoming interview with an outlet store this week,"I have an interview for a full time athlete job in one of my local nike outlet stores. Any current/former employees have any advice for me on what to expect during the interview? Anything helps, thanks!",Nike,1557196563,kiddocontay,7,2,True,2019-05-06
129,Trying to figure out what this shirt is... Vintage? Fake?,"I work at a Thrift/Antique store and I do research on unusual items.
We have this shirt that seems vintage, if this was on a newer shirt I would have wrote it off as being a fake/knockoff.
I can't figure out what this is... It seems like from the 60's / 70's.

Is it a Nike Prototype? Is it a vintage shirt that someone embroidered the nike logo on it?

Any Ideas?

Here is the album: https://imgur.com/a/ux6G2h1",Nike,1557262665,stthriftresearch,5,1,True,2019-05-07
133,Anyone got some used AF1s in Men’s size 12? Looking to grab a pair for summer but don’t really want to drop $90 on retails.,"Don’t really care about condition, though it will dictate what I’ll pay. PayPal invoice is best for me, for both of our sakes. Thanks a ton!",Nike,1557286669,phatbonghitsya,2,1,True,2019-05-07
134,Air max 270 air bubbles,"Yo, I wanna ask you guys, is the rear „U” shaped bubble the only one in the shoe? Does Airmax 270 have air bubbles in the front or middle parts of the sole?",Nike,1557315173,MortalNocturne,12,1,True,2019-05-08
135,"Nike Benassi Solarsoft Slide vs Nke Benassi Solarsoft Slide 2, does anyone know if the 2s are more comfy?",Just tried the solarsoft slides and was wondering whether the 2s are even more comfy.,Nike,1557315813,JaxTellerr,3,1,True,2019-05-08
136,Need help finding joggers from the 90s.,"Hi all,

i do have them, but they're slowly reaching  their EOL. Now here i am looking for some in a better condition.

&amp;#x200B;

All i can read on the Tags is: 

RN#56323

CA#05553

RFC#NME 920220 KL4

&amp;#x200B;

Materials: 

Outside, Inside Bottom Part &amp; Pockets: 100% Polyester

Inside Upper Part: 100% Cotton

&amp;#x200B;

And some images: [https://imgur.com/a/DgM1KxL](https://imgur.com/a/DgM1KxL)",Nike,1557321665,lavagr0und,0,1,True,2019-05-08
137,Is this the Nike fisherman beanie?,Which nike beanie is [this](https://imgur.com/gallery/uJE3ydv) . I like how small it is so that is does not bunch on the back when you wear it behind your ears like in the picture.,Nike,1557324984,JaxTellerr,2,1,True,2019-05-08
140,Should I buy Nike Flyby Low 2 basketball shoes?,"I wanna buy this shoe and I wanted to know how good the durability of this product is. I'll be using it for 2 years on a daily basis. 
Is there any better on the market with a similar price range? Please help me out.",Nike,1557335847,dopeweed69,0,0,True,2019-05-08
142,"GET fresh Verified Nike Accounts from me! Each one for $5. IF YOU WANT TO BE PREPARED FOR TRAVS SCOTT X NIKE secure as many as you can (i got 5 accs btw). Dm me now, secure some and increase your chances for coming biggest drop of the year!",,Nike,1557341885,BartPr,2,0,True,2019-05-08
147,Site with Nike shoes where I can also check sole height?,Site with Nike shoes where I can also check sole height?,Nike,1557357517,WertyX1,0,1,True,2019-05-08
148,Nike SNKRS question,"I got a question, if I have my own Nike snkrs account on my phone and have a relative make a separate Nike snkrs account with completely different information accept they’ll be using a card for payment and I’ll be using a paypal that is tied to the card for payment, will they still find a way to ban me from the purchase?",Nike,1557359980,devin_snkrs,0,1,True,2019-05-08
152,My left Nike Adapt BB suddenly fully tightened and won't undo!,"As the title says, on my way to work right now and literally as I stepped out my door it tightened to max and my foot is almost completely numb, been almost an hr and I've tried resting it multiple times and it won't loosen a mm from full tightness which is way too tight for my foot. My foot has got some serious numbness going through it. Genuinely don't know what to do!

Same thing happened to the right one the other day and after about 45 mins it randomly started working again but hurt a lot.",Nike,1557387910,ROBNOB9X,8,0,True,2019-05-09
155,Tom Sachs,Not that I’d have been able to pick these up in Chicago as the sneaker pass suggests...but I’m still a little bitter regarding the lack of publicity and notifications on the SNKRS app for these shoes. I scoured the internet for details on the release for the past week but could not find a single official Nike link...,Nike,1557417723,JarJarBinxxxx,8,1,True,2019-05-09
161,Mis-Match,Put my son in Jordan shorts and a Nike tee for Mis-Match Day and his teacher said he wasn't mismatched.,Nike,1557457071,JSteffn,4,0,True,2019-05-09
168,Nike AirMax Sequent 4.5 added height?,How much height do they add?,Nike,1557524162,WertyX1,0,6,True,2019-05-10
172,Black color looks grey during customization,"I am customizing a pair of Nike Air VaporMax 2019 and [this](https://i.imgur.com/XklPG0l.png) is what a 'black' base looks like. Does it actually end up looking like this? It looks very gray.

The Nike Air VaporMax Flyknit 3 comes in a [very black](https://www.nike.com/t/air-vapormax-flyknit-3-mens-shoe-JsWsB7/AJ6900-004) color so I am not sure why there is a difference.",Nike,1557538269,Albuyeh,1,1,True,2019-05-10
175,SNKRS app is absolute trash,I don’t know why I even try when I know I’m going to get consecutive errors regarding my payment method. What a fucking horrid app.,Nike,1557583405,JarJarBinxxxx,38,51,True,2019-05-11
176,"Whoever used a bot, your mom’s hoe",,Nike,1557584649,Alpmard98,1,17,True,2019-05-11
183,Mobile Shop Broken,"Is it just me, or is the mobile store not letting me open shoes and check my bag?",Nike,1557599760,Vedrigan,0,1,True,2019-05-11
187,Does anyone have any idea what shoes these are?,"I was looking on the nike website at some joggers and saw some shoes that a model was wearing with the navy blue joggers and was wondering if anyone had any idea if they are unreleased or not for sale or just on the website somewhere 

https://www.nike.com/t/sportswear-tech-fleece-mens-joggers-gXTOoz1v/805162-456",Nike,1557606559,sunsysideup,2,2,True,2019-05-11
189,SNKRS app in Canada,I know there’s ways for people in Canada to get the SNKRS app but I don’t think it’s worth it to make a whole new apple ID just to get the app. I think Nike should really considered Canadians when it comes to big launches.,Nike,1557609780,thetodaylife,1,1,True,2019-05-11
191,Selling FK utility,"
Here's a ebay link for anyone interested
 https://rover.ebay.com/rover/0/0/0?mpre=https%3A%2F%2Fwww.ebay.com%2Fulk%2Fitm%2F382948185749",Nike,1557610852,aaronjoemartin,0,0,True,2019-05-11
194,"Trying to order shoes online, forbidden access",I’m ordering air max 97s online and when I go to checkout it gives me a white page that says forbidden access. I have no idea what to do and I’m researching and people are saying it could mean an IP ban. Why would I be IP banned???,Nike,1557634918,karewa,2,2,True,2019-05-12
197,"I think we should be able to order custom shoes, tailor-made for our ankles'/feet's peculiarities","[https://news.nike.com/news/bill-bowerman-nike-s-original-innovator](https://news.nike.com/news/bill-bowerman-nike-s-original-innovator) says that Bill Bowerman, a co-founder of Nike and its first inventor, 

&gt;custom fit shoes to his runners by drawing an outline of their feet,  measuring widths and noting individualities, such as an extended heel or  slim ankle. 

&amp;#x200B;

We can buy tailored shirts, suits, dresses, pants, blouses. Don't our feet, with all the weight they're supporting, need the precision even more? Yes, it'll cost more than buying the Nikes with a size X and a width of W. But there could be a market for those who can afford tailored sneakers.",Nike,1557679826,cutereddit,11,14,True,2019-05-12
199,"Anyone know why tapping on the ""shop now"" button for the Nike adapt bb, it just sends you to the same page?",Was thinking about ordering a pair but I keep getting an issue where it just sends me to the same page. First time ordering something from Nike so not exactly sure what to do lol,Nike,1557683712,saskue87,5,2,True,2019-05-12
202,I’ve got a player sample pair of Jordan 31s. They’ve never been worn so there’s likely not even photos of the shoes anywhere being worn in game. Where could I get the shoes authenticated?,"The color is yellow in the back and navy in the front so I’m inclined to think they were associated with a Pacers player, nothing else to go off of save for a completed eBay auction on a similarly tagged pair of Kawhi Leonard Jordan 31s. I could provide an image later but I’m on my phone, even then it wouldn’t help anyone to indicate who’s they are.",Nike,1557687580,Hunterfj1,1,1,True,2019-05-12
222,Should I put the orange “SHOELACES” on the left or right of my Nike Air Presto x Off White shoes (white in colour),"I’m thinking of changing one of them to orange laces, should I do the left shoe (where the orange tag is) or the right shoe?",Nike,1557864890,TheSt14,1,1,True,2019-05-14
227,ID Please," I had these shoes for a while, and soon they'll have to be replaced, but I can't find the shoe at all. The closest I got was the Nike SB Portmore. I need help finding the shoe, thanks. 

https://i.redd.it/s6zh547cxay21.png",Nike,1557894078,JimbolikesWaffles,0,1,True,2019-05-15
232,What is the last dark picture of an all black shoe on the nike website?,Is it a custom option?,Nike,1557926891,Shadow_Serpent_330,1,1,True,2019-05-15
238,"Nike walking shoes, on a trip.","Hey guys, I'm taking a trip for a month, and looking for some advice on some of the most comfortable walking and getting around nike shoes. Preferably ones that I can get at the nike outlet and hopefully under $100. Any advice on what shoes I should be looking at. I'm going to be doing a lot of walking (flat land and up hills)

&amp;#x200B;

Thanks in advance.",Nike,1557947326,wd707,14,1,True,2019-05-15
246,What’s everyone’s opinion on the Nike Air Presto x Off White (In white) ?,,Nike,1558008082,TheSt14,2,2,True,2019-05-16
247,Help With Cleaning,"I recently bought a gray Nike sweater but while at school I managed to get a pencil mark near the zipper tried erasing it just made it worse 

What would be the best way to clean this ?",Nike,1558019432,WidowOneTrick,0,1,True,2019-05-16
252,Nike SB x Jordan 1 Lakers,"This may or may not be the right sub to ask, but does anyone know where the Jordan 1 x Nike Sb are dropping online. I know they release on the 25th but where? I’ve been looking everywhere some people say Nike Snrks, Stock-X, and Kicks on Fire. But I just wanna know. Please, any thing will be helpful.",Nike,1558055217,kibagami93,2,6,True,2019-05-16
258,does anyone know the name of this fit?,"&amp;#x200B;

[saw this on a shady looking website so im wondering if nike even made this as i cant find it anywhere else](https://i.redd.it/w7nl9sxi5sy21.png)",Nike,1558102660,RealCaptainLazy,0,1,True,2019-05-17
265,Zoomfly x Offwhite,"Hi guys, I was thinking of buying Zoomfly Mercurial x Off-White (Total Orange).
Would you recommend it for streetwear and casual? Or just for running?",Nike,1558168810,pottssingaround,3,1,True,2019-05-18
273,So I recently got Nike React Presto Black Phantom Red shoes and inside there’s a matador. Does anyone know why?,,Nike,1558219261,FvckChris,1,2,True,2019-05-18
275,Nike Hyper Gamer Low Christmas?,"Does anyone have any info on these shoes? I picked them up at goodwill. They have an”promo” tag and all I can find is that they are from the Christmas Day 2012 collection. They are called Hyper Gamer Lows. They have a gingerbread man holding a basketball on the tongue. I found a picture of James Harden wearing a similar pair, but the pair he is wearing appears to have a signature on the tongue instead of the gingerbread man. Thanks in advance!",Nike,1558230612,Demobrett,3,2,True,2019-05-18
279,NEED HELP Nike Tech Fleece Joggers TAG DIFFERENCE,"TLDR:
My Nike TF joggers tag is not RED as seen in all the photos on Nike.com or anywhere else. Its black.
I bought mine at an official Nike store in my country. Paid 100$, everything is the same except the Tag. Check pictures. Need your help on what might be the reason. 
Pics: https://drive.google.com/folderview?id=1-5Qgk46pqJyH2TlME2YHyUZZ-id_uzdc",Nike,1558273910,Dimitrijedk,4,4,True,2019-05-19
280,What does the “‘07”in the “Air Force 1 ‘07” mean?,,Nike,1558276028,thisusernameis_real,2,4,True,2019-05-19
286,Air Mags Mass Release?,Does anybody know if the Air Mags are slotted for a regular commercial release anytime soon?,Nike,1558313253,thesurrealbank,2,1,True,2019-05-19
292,"Nike faces backlash for its pregnancy policy, proposing changes. Read here:",[removed],Nike,1558355444,apparelresources_,0,1,True,2019-05-20
295,Nike Air Max 1 AH8145-007,"Hey,
Could someone who owns these tell me whether they’re good for rather hot summer? Thanks in advance :)",Nike,1558359542,M4tthev,1,1,True,2019-05-20
300,Vapormax 3.0,Does anybody know is nike going to drop some gold vapormax 3.0?,Nike,1558382850,nowornever121,0,1,True,2019-05-20
301,Air Jordan 1 - Size Question,"Hey there, got a couple of questions if anyone can hook me up.

1. My left foot is 26cm, right is 25.6cm, I'm usually a size 7.5 in Addidas, but 7.5 (UK) in Nike shoes 25.8cm, while 8 is 26.2cm.

I'd have 2mm of space with the left foot, and 6mm on the right. If I chose a 7.5, I'd be short 2mm on left and have 2mm free on right.

Any advice on which to go for? I've never worn Jordan's so have no idea of the fit, and I'm ordering online.

2. How often does Nike restock their website? The 7.5 in my colour is currently out of stock online.

Cheers for any help 🤘",Nike,1558400839,SeniorsOldSocs,1,3,True,2019-05-20
302,Do Air Max 95 have removable insoles?,,Nike,1558449602,shrek_01,1,2,True,2019-05-21
307,looking fore nike sfb zip in black,have been combing google for two days and cant find anything that doesn't seem like a scam site pls help,Nike,1558459683,Pete-Pizzamun,2,1,True,2019-05-21
310,Vapormax 3.0 vs 2.0,What are the differences between vapormax 3.0 and 2.0,Nike,1558469913,nowornever121,0,2,True,2019-05-21
314,Slides sizing,Just bought nike slide for the first time. Got the thick ones and went with my shoe size 9. They fit kinda snug. Will they open up or is it better to get a 9.5?,Nike,1558497135,Amanchhetri,2,1,True,2019-05-21
316,Question about Nike claim services,"I recently got a claim approved from Nike for a manufacturing defect on one of my pairs of shoes. They said they would send a voucher for the amount the shoe is worth, but, with the shoe having a production date of 12/2017, I could not find it on the website. How can I determine what amount I will get in the voucher?",Nike,1558531452,youngthug789,1,1,True,2019-05-22
324,Is it necessary to order a half size up on the Adapt BB?,"Interested in people's experience with the sizing on these. I've heard to size up by half, but others say they're true to size.",Nike,1558554355,TiananmenSqureMsscre,2,0,True,2019-05-22
327,Nike order pending,"been pending for over 24 hours, is this normal?

i am also locked out of my email that i think they use to contact...",Nike,1558561516,Jake_MVP,0,1,True,2019-05-22
328,Good outdoor hoop shoes?,"Any recommendations for a relatively cheap pair of hoop shoes? I play mostly blacktop so I don’t want to spend too much money on them. 

Just need something comfortable and reliable.",Nike,1558563683,quasimojoe,2,1,True,2019-05-22
330,Nike Dri-fit T-shirt’s with an Athletic/Contoured cut,"So there are these Dri-fit T-shirt’s that have a “contoured” or “athletic” cut. The ones I’ve tried are [here](https://us.wit-fitness.com/products/dry-training-tee-4?adept-product=dry-training-tee-4) and [here](https://www.roguefitness.com/nike-dri-fit-hyper-tee-mens-black-black), but I cannot seen to find a shirt with this same material and athletic cut on the Nike website. These seem to be custom made. Does anyone know of an equivalent shirt sold on Nike.com? These sites have my size sold out.

Thanks!",Nike,1558577415,blowout,0,1,True,2019-05-22
331,Help finding a shoe?,"I'm looking for a pair of Nike Air Force 1 AC BR QS in the polarized blue colorway.

Could anyone help find a place to buy these?

I found an Italian website that lists them but IDK if they're legit.

Product Code 694861-400",Nike,1558577451,JackC88,2,1,True,2019-05-22
336,What the most interesting size for reselling sneakrs and is StockX a good site to ressel shoes ?,,Nike,1558640103,CreepXII,1,1,True,2019-05-23
337,Most profitable size for shoes and StockX,"What is the best size for shoes that I want to sell. Like collectors shoes, what is the most interesting size ? The most profitable. 
By the way, is StockX a good site to sell shoes ?",Nike,1558640522,CreepXII,0,1,True,2019-05-23
338,List of manufacturer color spellouts and abbreviations?,"This is a little out there, but I'm getting mildly annoyed at myself for not being able to figure out the full color names when I'm putting together an eBay listing. Now, I know I can just throw up a picture and a style code and it won't really matter, but it bothers *me* knowing it's incomplete.

Example: Lebron XII ""Instinct""
CV PRPL/HYPR GRP-HYPR CRMSN-HY
Cave Purple / Hyper Grape / Hyper Crimson / Hyper...??

Anybody know if there's an un/official list somewhere with the colors and abbreviations? Or am I relegated to Google searches and best guesses?

Thanks!",Nike,1558649141,SinfulObsession,1,0,True,2019-05-23
341,Most profitable size for resell,"What is the best size for shoes that I want to sell. Like collectors shoes, what is the most interesting size ? The most profitable. 
By the way, is StockX a good site to sell shoes ?",Nike,1558673814,CreepXII,5,0,True,2019-05-24
342,Help me find these shoes,"I need help finding these shoes. I saw this guy wearing them but he didn't know the name of them. They had like six? holes and NIKE on the back. In the picture, they kinda look like roshe's but I'm pretty sure they're not. If you know the name of the shoes, PLS respond bc they look pretty cool.",Nike,1558675061,BrianBae1,3,12,True,2019-05-24
343,Anyone know where to find this?,https://twitter.com/kicksdeals/status/1130573831096000513?s=21,Nike,1558720267,fantasyhelp411,4,3,True,2019-05-24
349,How do you get XDR on Nike shoes,,Nike,1558777395,Mohit_Relekar,1,1,True,2019-05-25
352,Nike Quality became trash ?,"The quality of my custom made nike blazer mid is absolute trash. I have never seen such thin fragile leather on any other shoe. The shoe tongue is the worst part. After legit 3 hours of wearing the white of the tongue turns into orange because of the cheap foam. This is an insolence charging me 120€ when the shoe box is more expensive that the shoe in production. 

&amp;#x200B;

https://i.redd.it/rvrxyex2zc031.jpg

&amp;#x200B;

https://i.redd.it/zo7liqz9zc031.jpg",Nike,1558790649,sy-tarro,10,5,True,2019-05-25
368,Keep up with all the LATEST NIKE RELEASES!,"Hi guys,

&amp;#x200B;

Ive recently set up a youtube channel for sneaker reviews and updates, if you're interested please be sure to check it out - [https://www.youtube.com/channel/UCDm6yQ-q0DIB8B8qcHr5kig?sub\_confirmation=1](https://www.youtube.com/channel/UCDm6yQ-q0DIB8B8qcHr5kig?sub_confirmation=1)",Nike,1558877768,SNEAKYDROPCOP,0,1,True,2019-05-26
371,What’s the name of the shoe?,"I’ve seen some people wearing Nike shoes with this strange plastic looking square block behind the heel. Can’t find them online but I want to know what they are called. They look like training/lifestyle shoes. The block sticks out quite a bit at the back and I want to know the name of the shoe, please help!",Nike,1558885695,Hanno549,6,1,True,2019-05-26
378,[Identify] Nike Zoom Air ???,"Found these in pretty awesome condition at a thrift store, but having a hard time searching for the serial number, and I'm not coming up with anything. Here's to the hive mind, hopefully you can help.

http://imgur.com/gallery/82JMVY9",Nike,1558914593,Duke_Newcombe,3,1,True,2019-05-26
379,Best Nikes for hiking?,"I’m going to Europe for a few months, where I’ll be doing a good bit of hiking in the mountains and city waking.  Looking for recommendations for the best Nikes for this.  I’m thinking high tops for ankle support, but open to suggestions.  What do you recommend?",Nike,1558935414,Eki75,7,2,True,2019-05-27
381,Can you cancel an order on the snkrs app after being selected?,,Nike,1558952661,erichungus,0,0,True,2019-05-27
390,What are the best everyday shoes?,I’m looking for something comfortable but have a good/unique look to them that I can wear everyday whether it will be at work (I walk a lot) or just going out.,Nike,1558977597,WizardHackerr,7,1,True,2019-05-27
392,The most you’ve spent on shoes?,What’s the most you guys have spend on a pair of shoes?,Nike,1558992116,Lyn-Z007,4,0,True,2019-05-27
396,Pegasus 36 Turbo?,Are they going to release this or should I just buy the Pegasus 35 Turbo?,Nike,1559019694,bquintero18,7,1,True,2019-05-28
399,Tips on first Nike shoes,I bought a pair of Nike Air Max Alpha Trainers for running and casual usage and was wondering if there's anything better for a first one. I have 45 days to return them.,Nike,1559045830,KGiffoni,4,1,True,2019-05-28
402,Is there any hope in cleaning these?,"I got these a while ago and they got dirty so easily. I recently wore them to a dairy farm and they got really messed up.

How can I clean them? Can I throw them in the washing machine?? Or should I just chalk them up as a loss and wear them as beaters?  [pic of my dirty nikes ](https://imgur.com/gallery/lvLSlyr)",Nike,1559068147,nstytokenbg,2,1,True,2019-05-28
404,Question,I have a manager who got me a pair of Off white 97’s and off white Chicago’s for retail and they seem pretty legit he says that his cousin works for Nike corporate and he’s pretty high up there but I just don’t know it feels too good to be true what do you guys think?,Nike,1559083104,Traplordrafa,1,2,True,2019-05-28
405,Wont let me buy anything,I'm trying to buy a couple pairs of shoes while they're on sale and i keep getting a payment invalid and I have tried it through PayPal and both my debit and credit cards and it still doesn't work so I want to k ow of anybody had the same problem before and how do you fix it,Nike,1559086882,Redsolo57,4,1,True,2019-05-28
406,Help me ID sneakers that had spandex over the laces that zipped up to cover them?!,"I think they would’ve been out in 1994 or 1995. They had an air pocket that I’m pretty sure stretched around the heel. Mid tops, maybe a cross trainer. They were different shades of gray and the laces and maybe a few other accents were this electric yellow color. It wasn’t neon, it was kind of dull but bright. As the title states, they had a spandex like material that zipped together over the laces to cover them. The insole might’ve had a bio mechanical type pattern on it. They looked futuristic and tech-y especially for the time. Any and all help or ideas would be greatly appreciated!",Nike,1559089742,dinosaur3rd,2,1,True,2019-05-28
410,Airmax 720 question,So im thinking of buying the triple black 720s and I was wondering if they are rainproof? Will my feet get wet in them or?,Nike,1559111564,Gabo1399,1,1,True,2019-05-29
413,Single use 20% off code for Nike.com,"Expires today, didn’t end up using it so passing it along in case someone was eyeing something. Please post if you used it to save others the trouble: 

USCS20P6V3KF3ZG5",Nike,1559137797,SnowBob302,0,3,True,2019-05-29
414,Spotting fakes,Can anybody help me and tell me the best way to spot fake Element 87s? Through pictures. I already asked for a tag from inside the shoe but is there anything else? Thanks,Nike,1559142636,santiar5,0,0,True,2019-05-29
416,id on this airmax pls,"&amp;#x200B;

https://i.redd.it/aq6zlpfpl6131.jpg",Nike,1559149255,MauryAvero,0,1,True,2019-05-29
420,Are air maxes considered non slip?,"I have 10-15 pairs of air maxes, and if I’m wearing tennis shoes, I’m wearing air maxes. However I need non slip shoes for work and I’m not sure if these are considered non slip",Nike,1559155747,brit_666,8,2,True,2019-05-29
423,What laundry detergent/stain remover do you guys use for your dri fit clothing?,I have several stains on a lot of my Nike dri fit clothing and am just curious what you guys use because what I’ve been doing isn’t getting rid of any stains,Nike,1559160436,BobeKrown,2,1,True,2019-05-29
424,Nike LunarEpic Flyknit 3.0 Lows?,Does anyone know if the 3s will be dropping ever? This is my favorite Nike shoe. Great balance of comfort and support.,Nike,1559162038,bquintero18,6,3,True,2019-05-29
427,What are the best shoes for running / everyday walking for people with flat feet?,,Nike,1559170826,theswifty7,2,3,True,2019-05-29
432,Any info on when the Nigel Sylvester AF1s are returning to NikeID?,Thanks!,Nike,1559222347,Marz6,0,1,True,2019-05-30
433,how long does it take for SNKRS to let you know if you got them?,wondering cause its been a bit,Nike,1559228148,CutCleqnUHC,3,1,True,2019-05-30
