,title,selftext,subreddit,created_utc,author,num_comments,score,is_self,timestamp
437,tech fleece joggers size guide,"I'm a 5'7 (171cm), 138lb (63kg) female and i'm unsure which size to get. I'm average build, wide hips and narrow waist. I'd like for them to be a bit tight but not like leggings tight. there is no store close where i can go try them on so i'm coming to you. Should i go for a size Small or Medium? 

ps; will they shrink when i wash them? 
A huge thank you in advance!!",Nike,1567351034,iiisfeld,0,1,True,2019-09-01
438,employee store?,anyone have any idea or lead as to how I can get passes to visit the employee store in Portland when I visit in like 3 weeks?,Nike,1567357076,Aftashok,8,1,True,2019-09-01
443,Air force 1 Sizing,"So I'm planning to buy a pair of Air Force 1 premium 2 (the pair with the oversized swoosg) once they restock in my size and I'm not sure what size to get (I've been told they run half a size big but other also say they're TTS), I haven't been able to go out to try on a pair of air force 1s since school started. I wear a size 7.5 in Van's Sk8-Hi's, I wear a 7 in converse but I also fit a 7.5 with my toe at the middle of the toe cap, I wear a size 8 in the Nike Pegasus 35s and a size 8 in Adidas NMDs. My feet are fairly narrow too. Any sizing tips would be a great help!",Nike,1567385316,_Mochii_,3,1,True,2019-09-01
448,Need info on THIS jacket please,"
https://www.caliroots.com/nike-down-fill-bomber-guild-866029-010/p/72651

If anyone has info please tell me. Is it a jacket for really cold weather like winger or more like spring and autumn. How does is it fit?",Nike,1567446583,sstsebiggestfan,0,0,True,2019-09-02
451,Sponsorship,"Hi i do wonder what the requirement for getting sponsored by nike is,",Nike,1567450033,Arinali1,1,0,True,2019-09-02
456,Shoe Dog- Phil Knight,"Emphatic, Real, Witty, Amusing and above all Honest.
This is going on my wall.",Nike,1567504627,IroIro47,5,1,True,2019-09-03
462,are the nike air zoom windflo 6 men’s running shoes good for running?,"Need to know, for specifics i’m running cross country right now, but also will be running track when the season comes.",Nike,1567527665,lordkoldi,1,1,True,2019-09-03
466,How to wash white Vapormax FK3’s,I have a brand new pair of Nike Vapormax Flyknit 3’s and they are sweet when they are clean but get dirty very easily more so than any pair of sneakers I’ve owned... like the dust from the driveway is showing up brown after Sox a full month of casual wearing... SO THE $190 QUESTION HOW TO WASH THEM THE CORRECT WAY AS RECOMMENDED BY NIKE IF AT ALL? Thanks guys I appreciate any and all feedback!,Nike,1567555244,suprarb112,0,2,True,2019-09-03
471,Has anyone found Joyrides in store?,"Hi everyone,
I’m looking to pick up the joyrides but really want to try them on first. Has anyone found them in stores?",Nike,1567618814,00x-4a-6f-68-6e,1,0,True,2019-09-04
472,Can i return nike shoes that i wore outside?,I heard thats possible? (Germany),Nike,1567620336,Lesi159,0,1,True,2019-09-04
473,Wish I could get a pair of those acg boots like I had in third grade😔,,Nike,1567621192,julesbennett,0,0,True,2019-09-04
479,Recommended shoes as a gift?,I’m looking to buy a pair for Nike Jordan’s for a friend for their birthday. I don’t know which ones to really get so I’d like to ask you guys for your personal favorites.,Nike,1567643157,Darkwolf2081,0,0,True,2019-09-04
480,I ordered some shoes from nike’s online store and got a size too big. Can i return it to a local nike store and can i return the shoes for my reason,,Nike,1567645678,Huge-M1dget,5,0,True,2019-09-04
483,Nike Tech Fleece,Where can I get these tracksuits! They seem like they're sold out absolutely everywhere!,Nike,1567706136,Hyphron,1,0,True,2019-09-05
497,Haven’t received order,I ordered a pair of obsidians on release day off the snkrs app and it got shipped the next day but ups tracking just remains on shipped and haven’t gotten any updated info regarding it. Should I wait a couple more days for the order or should I just assume I’m not getting my pair and just get my refund.,Nike,1567773020,jvansies,1,0,True,2019-09-06
498,Anyone know if the blazer mid ‘77 will restock in habanero?,All they have on the site rn is the hello but I’m looking for red :/,Nike,1567779447,SAUC3D25,0,0,True,2019-09-06
1,disapointed,Colin kapernick is an un American scumbag who has no respect for his country and said an American flag shoe is offensive and Nike caved in. so sad but it's liberal logic,Nike,1562175603,highschooldxdlol,24,0,True,2019-07-03
2,Nike is racist or Un-American which do you think?,Only a racist company would put out a racist symbol on a shoe design...... Or Nike is Un-American for bowing to political pressure....,Nike,1562178952,LORDOFTHEFATCHICKS,15,0,True,2019-07-03
10,Why most countries don't stock US11.5?,"sizes come in at ... 10, 10.5, 11, 12, 13

now that they keep making shoes a half size too small, i can't get the right size.

anyone else have this problem?",Nike,1562203801,ReverseRunningClub,3,1,True,2019-07-03
13,Removing the poofiness of some SB dunk highs?,"Has anyone successfully removed some or all of the padding in the the dunk highs? 

I’ve got a pair of big gulps that I bought way back when they were first released, and they’re in terrific condition. My style has long since moved from poofy shoes, but I love my big gulps so much, getting rid of them is just not an option. But also wearing gigantic shoes is also not an option... so, I did some googling, didn’t find much, but has anyone reduced the bulk of their dunk highs successfully? I’m pretty crafty, and could easily do this myself, but I don’t particularly want to slice up my shoes without a plan moving forward...

Thanks!",Nike,1562207847,ertmeister,2,2,True,2019-07-03
16,What’s a good pair of like dark grey or black running shoes?,I have a bad habit of always buying white shoes and they look great in the box and in the store but the minute I wear them out they look horrible.,Nike,1562224595,fbeeye,0,0,True,2019-07-04
18,Dunk Low Pro iw tie dye,"Where can I find the Dunk Low Pro iw tie dye, I can't find them anywhere in my size.

https://i.redd.it/nxl0gxry9a831.jpg",Nike,1562244670,arman_vdb,0,1,True,2019-07-04
21,As 5ft 6 should i get a XS or S sized t shirt?,Any experiences?,Nike,1562251357,carljohnson234,4,1,True,2019-07-04
22,Should I get the Vapormax Plus or 720s?,"I’m trying to decide between the Nike air Vapormax Plus and the Nike air max 720s. 

Which ones do you think look better, are more comfortable etc...? Thank you",Nike,1562255178,CaptainMuffenz,1,1,True,2019-07-04
25,Looking for Flyknit Free 4.0s,"Hello to the community and I’m happy to be here! I turn on you for help because you will definitely have an answer to my question.


https://imgur.com/a/OxVOefp

I am looking for Nike Flyknit Free 4.0 as the one seen on the image. Without a bumpy sole on the back like the current Free Rn pair I have, clean, thin and straight lined, imo the perfect shoe. Can’t find them anywhere. I would appreciate it a lot if someone more experienced could maybe show me where I can buy these from. I’m not interested in fakes or used ones.",Nike,1562279007,Kalimero8989,0,1,True,2019-07-04
28,Hey does anyone know where I can still buy nike magista soccer cleats?? Thank you,,Nike,1562302387,mossi17,0,1,True,2019-07-05
30,Want to use my gift card to buy Jordan 1 Flyknit shadow,"I have a nike gift card and I want to use it to buy the Jordan 1 Flyknit Shadow. 
But the problem is that it's not available on nike website, or any store. But you can easily find on other stores/websites like footlocker for instance. 

I specifically want this one, this color. 

How can I use my gift card to buy it (maybe on other stores) ?",Nike,1562318217,panzerfausted,1,1,True,2019-07-05
33,I absolutely LOVE your new CEO!,He gets more coverage now than he ever did playing on the field.,Nike,1562331988,Nalukai,3,1,True,2019-07-05
34,NIKE,Seen some lads who are getting full refunds and the item from NIKE by doing some sort of returns glitch thing. Anyone know how to do it?,Nike,1562339022,harambe277,2,0,True,2019-07-05
36,Custom size changes,"Every year I custom order a pair of Nikes, as it’s my only option. (Being a US men’s size 17) last year I bought a pair of Metcon 4s in my size, but when I went back this year to order another pair, the size chart only goes up to 15. What’s up with that? Are there any other thin soled cross-training/lifting/running shoes that can be ordered in a 17?",Nike,1562362304,HEXC_PNG,0,1,True,2019-07-05
38,NikeID Question,My NikeID says build complete but it says est. Arrival is the 22nd. Will I most likely get it before then? Thanks in advance,Nike,1562373393,TheRealBabbler,1,1,True,2019-07-05
40,Total shoe noob and I want to buy some Jordans.,"Hey, I'm hoping this fits in you fine peoples sub, but I am looking for a bit of advice. I normally buy cheap vans from Fred meyers for $30, but the past few months I've been really want to ball out with some nicer shoes. Specifically, I really like the air jordan 1 retros and Jordan 1 mids in white/black/gym red, they are primarily white. I fucking love how these shoes look and I'm the type of guy who gets obsessed so I'm sure I'm gonna end up spending a grand or so by the end of the year to keep my feet fresh. 

My question, are there any website you guys trust and have used multiple times that sell discounted Jordans? The specific model I want is MSRP at 110$ and the reputable store I know like Footlocker, Nike, champs, etc sell them for 110. But I've seen a few sites I've never heard of selling the same shoes for 80-90, depending on the site. Do you guys have any sites you'd be willing to direct me to that you know is trustworthy? Or any sites where I can find Jordans on discounted prices that aren't scams? I'm always about the deals, so I figure I'd at least ask before I head to champs tomorrow and pick my new shoes up.

Thanks for any and all help you great people cab give me!",Nike,1562401584,King__ginger,3,1,True,2019-07-06
44,Do the Nike Tanjun sandals stretch??!,I wear a female’s size 8 but the ones I have feel snug and just barely don’t fit I’m just wondering if they’ll stretch over time as I wear them?,Nike,1562449286,ttuskan98,0,1,True,2019-07-06
49,SNEAKER BATTLE 2K19,Cant decide between buying the air max 270 or the vapormax. Can anyone give me an argument as to why which one is better than the other? Thanks!,Nike,1562474442,majiraak,2,3,True,2019-07-07
55,NIKE and the Colin Kaepernick Controversy,https://against-the-odds.net/2019/07/07/the-colin-kaepernick-controversy/,Nike,1562513899,AgainstTheOddsMK4,4,0,True,2019-07-07
56,"Nike, can we get the Four Star USWNT jersey for men, please?","I would really like to support the Women as a male fan, but it’s impossible to find a Men’s cut jersey with the stars. I’m willing to bet you’ll sell just as many if not more than the Men’s team.",Nike,1562521384,robbopie,2,2,True,2019-07-07
60,Okay before it happens just to be clear how does buying sneakers on the app work?,"Do I just get on at 10 and go, or are there extra steps I need to know about?",Nike,1562536891,cory453,0,1,True,2019-07-07
61,Can someone help me ID these?,"I found these at Goodwill. The number tag is VERY worn down. It looks like ""?17?82-00?"" My best attempt is ""317982-002."" I think date is 12/22/12. Im looking for an ID on the colorway. I've scrolled through thousands of Google images and haven't found it.",Nike,1562538051,OpieBot,0,1,True,2019-07-07
68,Nike tech fleece size,I am planning to buy a pair of tech fleece joggers but confused about which size to buy. For reference my height is 6 feet2 inch and weight is about 200 pounds.i usually wear slim fit jeans size 34-36.I am going to use it for gym so there should be room for movement but also don't want it to be baggy. There is no Nike store nearby so I am ordering it online .Any help would be appreciated.,Nike,1562579509,bubche666,1,1,True,2019-07-08
72,Best Nikes for standing all day?,,Nike,1562636033,parksandtheoffice,2,1,True,2019-07-08
77,"Stranger things drop at 8am, is that west coast time? Im mountain and want to get lucky on a pair. Tips?",Title,Nike,1562659979,xColaDoo,1,0,True,2019-07-09
84,ID on these Nike high tops,"&amp;#x200B;

https://i.redd.it/p0f1ju1z6b931.png",Nike,1562691617,GuyNamedNoah,0,1,True,2019-07-09
88,Trying to find a Nike ad,"Saw a Nike ad (few weeks back I think?) Where there was this kid who sent a letter to 3 different people saying that he broke his leg or something and that he looks up to (&lt;insert 1 of 3 peoples name) and was asking for shoes if they couldn't make it to meet him.

At the end the 3 people sent the shoes and he got it, then he said ""can't believe this is still working"" as they zoomed out to the hundreds of shoes he had lol

Can't seem to find it anywhere though, I'm 99% sure it was nike. Anyways Thanks in advance for any help! :D",Nike,1562699201,TopNotchGamerr,0,1,True,2019-07-09
90,Replacing Air Max 2016's,"Hey, i hope i found the right sub. 

I have 6 pairs of Nike Air Max 2016's i rotate through (typically one per day). They are starting to look worn. 

Specifically bought them because of the cushioning effect they had on my feet when walking (i'm on the havier side).

&amp;#x200B;

&amp;#x200B;

So I am looking to replace them with something new that has the same cushioning effect.

&amp;#x200B;

Q1: Is there no Nike Air Max 2019 ? i found 2018 and 2017.

Q2: are the VaporMax 2019, Air Max Deluxe or Air Max 720 any good ?

Q3: is there another shoe i should concider ?",Nike,1562716383,TotallyInOverMyHead,3,1,True,2019-07-09
92,Trying to verify online if a pair of shoes is available at Nike Town in Chicago?,Does anyone know a way I can verify if a pair of football cleats is available in a Nike store through their website?  I have tried calling the store and have been placed on hold for close to 20 mins only to be picked up and hung up on.  Called back and now on another hold (going on 5 minutes).  None of the other athletic stores carry the type of cleat I am looking for or else I would have gone there.  This is starting to get ridiculous...,Nike,1562719364,dynodonfb7,0,1,True,2019-07-09
95,Nike React Element 87,Which colorway is better? The moss colorway or the volt/bright crimson colorway?,Nike,1562732687,5cubaDann,1,1,True,2019-07-10
99,Where can I find these Jordan basketball shorts? Rare Team USA shorts?,"Not sure what these are called or if it's even possible to purchase but I like the look. 

&amp;#x200B;

[https://www.ebay.com/itm/NIKE-AIR-JORDAN-CUSTOM-MADE-RETRO-BASKETBALL-SHORTS-WHITE-BLUE-RED-USA-VI-VII/390738589857?\_trkparms=aid%3D111001%26algo%3DREC.SEED%26ao%3D1%26asc%3D20160908131621%26meid%3D2e1835900df946229f3fc6f2446b42ad%26pid%3D100678%26rk%3D1%26rkt%3D15%26sd%3D390738589857%26itm%3D390738589857&amp;\_trksid=p2481888.c100678.m3607&amp;\_trkparms=pageci%3A678fcc1f-a302-11e9-a1d2-74dbd18075bb%7Cparentrq%3Adb8dd2ae16b0ac3c6a99d176ffb4fadf%7Ciid%3A1](https://www.ebay.com/itm/NIKE-AIR-JORDAN-CUSTOM-MADE-RETRO-BASKETBALL-SHORTS-WHITE-BLUE-RED-USA-VI-VII/390738589857?_trkparms=aid%3D111001%26algo%3DREC.SEED%26ao%3D1%26asc%3D20160908131621%26meid%3D2e1835900df946229f3fc6f2446b42ad%26pid%3D100678%26rk%3D1%26rkt%3D15%26sd%3D390738589857%26itm%3D390738589857&amp;_trksid=p2481888.c100678.m3607&amp;_trkparms=pageci%3A678fcc1f-a302-11e9-a1d2-74dbd18075bb%7Cparentrq%3Adb8dd2ae16b0ac3c6a99d176ffb4fadf%7Ciid%3A1)",Nike,1562757768,Curious_George_Asks,0,2,True,2019-07-10
102,Nike Promo Codes?,"Does anyone have any online Nike promo codes? I'm looking at getting an expensive pair of running shoes that just dropped and I need to try and reduce the cost.

Please Help!",Nike,1562776770,titi321,2,0,True,2019-07-10
105,found betsy ross.,"its the first official confederate flag

&amp;#x200B;

https://i.redd.it/sjx7qgk4fk931.png",Nike,1562803333,TheFatLazyasscat,0,0,True,2019-07-10
106,What is the best way to get rid of counterfeit shoes?,I bought a abandoned storage unit and I found three pairs of shoes inside. One is an obvious fake two other pair I am not 100% sure of. What is the best way to get rid of the counterfeit pair permanently so they do not fall into the wrong hands and what is the best place to find out if shoes you have are fake?,Nike,1562805775,anamoirae,2,0,True,2019-07-10
112,How do I lace zoom winflo 4's?,I know how to lace a shoe normally but never had a pair with these loops on the side by the lace holes?,Nike,1562863205,JordanASMR,0,1,True,2019-07-11
114,Which AJ1 is getting Nike lunar sole?,"I thought i read somewhere about an AJ1 getting a better cushion from the Nike stable, think it was the Lunar sole?",Nike,1562864484,denimiskillingme,1,1,True,2019-07-11
116,Athletic Apparel,"We’re a team of young professionals looking to quickly survey **people who have an opinion about the sports apparel brands they wear**. 

Sound like you? Let us know anonymously in the link below (and no, we promise this isn’t a scam):

**Link:** [https://forms.gle/3LnBYtmMzhWYVPgN6](https://protect-eu.mimecast.com/s/7eR4Cy9L9IZYOYuMEX4P?domain=urldefense.proofpoint.com)

We appreciate your time and help!",Nike,1562869979,Fit_Minute,1,3,True,2019-07-11
121,Nike Fit Release Date?,Anybody heard any rumors or know any inside information as to when this feature will be released on the Nike app. It was scheduled for release in Early July and we're kinda approaching mid July 😅. Really curious to know what this feature will tell me my ideal shoe size is.,Nike,1562901812,Hoops_Junkie,0,1,True,2019-07-11
127,Stranger Things Shoes,Lol this is a very late post to ask questions but help is appreciated.  Can you only buy these shoes through the Nike SNKRS app? or can it be through the computer? Thanks!,Nike,1562938490,JerryWang027,5,1,True,2019-07-12
132,Want to print a design on a nike miller dri fit t shirt,Does anyone have a specific website they go to? Im thinking Ill be printing on 4-5 shirts,Nike,1562958829,kybervoid,0,1,True,2019-07-12
141,Nike is anti white,[removed],Nike,1563035365,tellmeaboutyourself1,0,1,True,2019-07-13
146,Need your advice,"I need some shoes for basketball ! 
So I have 3 shoes that I can buy 
1, Kyrie 5 
2. PG3 
3. Freak 1 
Which is better ? And why ?",Nike,1563105591,PewPewGloriaOopsie,3,1,True,2019-07-14
147,Nike Air Max 1,I’m trying to find Air Max 1 wolf grey gunsmoke but I’m not having any luck. Do you guys know where to look?,Nike,1563107677,kalvinpatel,1,1,True,2019-07-14
149,Hello does anyone know AIR MAX 97’s price in Vancouver or Outlet or Nike Factory Stores?,Cause I’m about to Vancouver next week and wanna if it is cheaper than Taiwan’s price,Nike,1563116794,AxnieWolf,4,1,True,2019-07-14
150,STRANGER THINGS,"Hi, does anyone know where I can still cop all the shoes from the collab? Please I'm desperate and I really want them and hopefully good karma will come your way because I would really appreciate it. I live in NYC so if any store nearby I'll go asap buy online is great too. Thanks.",Nike,1563129238,miahnyc786,1,1,True,2019-07-14
151,Paid cook group. Free for a limited time. Lots of giveaway (currently nsb) dont miss your chance to cop another hyped release. Lots of info,https://discord.gg/WaeeB96,Nike,1563133000,dennnnnnnnnnis,0,0,True,2019-07-14
159,Nike Air Max 270,Does anybody have any colors they recommend? Or any other styles that are like 270’s?,Nike,1563195035,Mia28348,0,1,True,2019-07-15
162,Air Max 270 React,"&amp;#x200B;

[Got to cop this one and I love it. ](https://i.redd.it/sahw6jzicha31.jpg)

&amp;#x200B;

Thoughts: 

That React midsole is probably the best right now.  
 I was surprised by how comfortable I felt wearing the shoe.   
 It does take some time before you will get used to the Air unit. 

I looked forward to the release of this shoe since I saw the USWNT rock it for a World Cup event. No regrets getting this one.",Nike,1563202034,clonesemble,0,4,True,2019-07-15
168,What’s with 8:88:88?,I’m seeing the 8:88:88 in digital font (7 segment) on a number of Nike running shoes including my  zoom Fly.  I was wondering if you’re intended to somehow modify these into your personal best race time. If so how?  Mine are black print on a light color.  Some are reversed so I could see filling in with sharpie....,Nike,1563231088,Joshua_and_Indy,5,3,True,2019-07-15
172,Nike Tech Fleece Joggers,"I'm 6'2 and i usually wear a 33x34-34x34 for my jeans, what size Tech Fleece Joggers should I get?",Nike,1563236753,e-t-su,1,1,True,2019-07-15
177,I saw a pair of nikes that i like but cant find them,Hello i saw a nike shoe but the sole was like the sole in yeezy 700 wave runner. Any ideas on how its called? I want to buy a pair,Nike,1563311811,Newesterely,2,1,True,2019-07-16
179,Delivery time for custom Metcon 5,"All they say is it'll take 4 weeks or less. Has anyone ordered, and how long did it actually take? I'm in Toronto if that adds anything.",Nike,1563319673,yukonwanderer,0,1,True,2019-07-16
182,Nike we got a problem here,"This is a problem with Nike’s uniforms in college and professional sports. Now before you start mentioning anything, no this is not going to be a political post. And I’m not trying to troll, I’m trying to provide suggestions for anyone who might know Nike dealers or anyone who makes uniforms with Nike.

But Nike, what is your deal with screwing up uniforms in both college and professional sports?

There are very few circumstances that a new designed Nike uniform in sports looks good. Take Clemson’s retro football uniform as one of the few examples.

What’s the exact problem with Nike? Let’s start out with

1. Coloring
Nike you have a problem with dark colors. What’s wrong with royal blue man? How about orange, or maybe powder blue? Take Ole Miss’ college football uniforms (I’m not an ole miss fan), they’re fine but they’d look so much better if they weren’t navy blue. So many teams have navy blue, it’s the least original color there is. And take the Miami Dolphins jersey before the touchup. Why would you include like a dark blue lining there? What was the point? Why did you get rid of the orange? And with the lakers, why did you change the color to banana yellow? Do us a favor, and stick with the colors that are already provided. Don’t change them, don’t add anything new, stick with the old colors.

2. Trying to incorporate their own design
Look I get that you want to make teams unique, like Syracuse with gradients, or the seahawks with that weird helmet design, but what people prefer is simpler classic looking jerseys. How many people do you see complaining about the cowboys uniforms, the crimson tide, or the Celtics classic greens? Every year, the lowest ranked jerseys in college football, professional football, and professional basketball are the ones that have too much going on or trying to incorporate their own “new” look.

And probably the most important one
3. What’s your problem with block style numbers?

Seriously did a kid wearing a block style jersey bite your balls off as a kid? There’s nothing wrong with keeping the numbers in the standard football font. Every now and then a different font looks good on a particular jersey (IE Bears, Steelers maybe), but 99% of the fonts Nike creates to add flair look very shit.

I don’t want to rat on Syracuse again but their old uniforms in college football had the most disgusting number font. You’ve made LSU’s font look like it was put through a taffy puller. You make the Dolphins numbers look like a malnourished child. You made the seminoles numbers look like they could rip my finger off just touching a jersey. 

Block style numbers aren’t bad, simplicity and the classic “football” looking uniforms are what people prefer. Pitt’s and Syracuse’s new uniforms this season are a step in the right direction, and even the Detroit Lions look alright, but you fucked with the numbers again on all 3. Please stop with that shit. 

Nike, just keep the classic colors, don’t try to add some “unique” flair to a uniform that doesn’t need it, and stay away from any number font that’s not a form of block style

Thank you and have a nice day.",Nike,1563343248,mattcojo,0,1,True,2019-07-17
185,Jordan 720 Proto Max Air Leaking?,"Hey all, I got a pair of Jordan Proto Max 720s today. When I walk there seems to be an air escaping sound or some kind of wooshing coming from the left shoe. Right one is fine, anyone know what this is or had anything like this happen? Brand new pair delivered today!",Nike,1563356346,herb0x,4,1,True,2019-07-17
188,Wasn’t sure about these - but the colour bangs!,"I know, skinny legs! 🙈 I’m happy with them 😊

Nike OW Zoom Terra Kiger 5 - Electric Green
Fit: TTS, fits tight on the foot. Very comfy
Looks: look way better on foot, and although, initially, I preferred the white version, these ones look awesome, and suit my sexy dark complexion. 

About the spikes: these designed to be walked on all surfaces, and the spikes will wear down off, which is meant to add to the aesthetics of the shoe.",Nike,1563375180,DarkSkye1,6,4,True,2019-07-17
189,Skinny legs!,,Nike,1563375361,DarkSkye1,0,1,True,2019-07-17
195,Consumer support sucks,"So I purchased Nike air Max from India and after just one run at the field, the ""air"" part of one the right shoe deflated. I mailed Nike India about this and they want me to show up at that particular store so that they can ""examine"" the condition. Now that is just plain ridiculous, I've sent them videos and photos including all the original receipts. Is there an my alternative?",Nike,1563395122,rrrishabhhh,6,3,True,2019-07-17
