,title,selftext,subreddit,created_utc,author,num_comments,score,is_self,timestamp
3,"I just ordered the Zoom 2k's for only $65, is it as good as people say?",,Nike,1568064033,VhetnoV2,1,1,True,2019-09-09
9,w9.5 in men’s?,"I’ve found a pair of air max 97s that i want to get, but they’re a women’s 9.5, Im a men’s 8 and i’ve seen charts saying 9.5= 8 but also that 9.5=7.5, just wondering how true to size the air max 97s are",Nike,1568086553,jacobezam,4,0,True,2019-09-09
11,Best white paint for Air Force 1,I got some af1 and I’m trying to restore them what is the best white paint you would recommend,Nike,1568094736,Toxic576,2,0,True,2019-09-10
25,Older Moldels,"Any idea on where to get cheap older model shoes.
Particularly and of the Free RN Flyknits. I’ve done research and all I can find is the 2018s which are around $100.",Nike,1568224794,knarleycharlie16,0,1,True,2019-09-11
28,Help me ID shoes?,"Hey all-saw these super cool men’s shoes on the train but he got off before I could ask him about them. Light grey with dark grey tongue, light blue inside, purple swoosh and purple/blue accent near front of shoe. Any ideas? There was a purple design on the tongue but didn’t get good look :(",Nike,1568234845,beantownbb,3,1,True,2019-09-11
32,Cheap Website,Do any of you know of any good websites to buy older model shoes. I’m looking for any Nike Free RN flyknit or KD11s. Thanks,Nike,1568260231,knarleycharlie16,1,0,True,2019-09-11
34,Any websites?,"Any websites for cheap air forces? Someone was telling me he can get some online for like 10 bucks or they have a bulk ordering where you can order several for a small price. But if there is a website where I can get some cheap air forces like less than 80 would be nice. I mostly like mid and high , in white, black, blue, or red",Nike,1568262395,X64Wario,3,0,True,2019-09-12
35,Anyone know what this shirt is?,"&amp;#x200B;

https://i.redd.it/ytji7xh9o5m31.png",Nike,1568290819,shocktherapies,3,1,True,2019-09-12
36,F*ck you Nike and the SNKRS app.,And fuck you who cop to just resell. You spend 2 months pining over a shoe only to take an L and that’s it.,Nike,1568297759,SFWreddits,4,0,True,2019-09-12
37,What do you all think of the Obsidian's,,Nike,1568298263,Misdirecti0n,0,1,True,2019-09-12
43,Looking for a specific model,"Simple running shoe, may be about two seasons old... 

Has an air pocket sole very similar to an Air max 97/98 or 720, but it wasn’t any of those.

Thanks!",Nike,1568330478,stashkoto,5,0,True,2019-09-12
44,Looking for these nike metric,"In women's 11.5. Any help is appreciated! 

https://i.redd.it/r2j8j6m7g9m31.png

https://i.redd.it/fn5985m7g9m31.jpg

https://i.redd.it/i8ard7m7g9m31.jpg",Nike,1568337701,lockndropent,0,1,True,2019-09-12
47,Help me track down this specific design of t-shirt,[removed],Nike,1568344581,nightwing4945,0,1,True,2019-09-12
53,"Bought adapt huaraches on the nike app, told they would let me know if I got them...",Hi- how long does it usually take to be notified if you get a shoe on the snkrs app?  My order went through for the adapt huaraches but it said they were processing... how long will it take to find out if the order went through?,Nike,1568383949,alrightbudgoodluck,3,0,True,2019-09-13
54,Help determining legitimate Nike x Sacai,"https://rover.ebay.com/rover/0/0/0?mpre=https%3A%2F%2Fwww.ebay.com%2Fulk%2Fitm%2F323903913780

Had anyone here bought a pair of Nike x Sacai on ebay before? This one has plenty of return time, and ships from already in the U.S. I've seen plenty of videos on how to determine if these are knock-offs or not, just wondering if anyone can confirm from the images in the ebay link or not. 

Price range on ebay for this specific colorway is approx. $190-$200, are these the real deal?",Nike,1568385944,NoahCoadyMC,7,1,True,2019-09-13
57,Are womens sizes the same as mens for Nike M2K Tekno trainers??,There is a particular colour of Nike M2K trainers that I like that is only available in the womens range. I am UK size 9 and the shoe for womens is size 9. Is the sizing the same? Thanks.,Nike,1568401703,johnnyredneat,1,0,True,2019-09-13
58,Laces,What kind of laces does the FoG Raid comes with? I'm planning on buying the Platnium colorway but want to change the laces out for black ones.,Nike,1568406910,Hoxton_0451,0,0,True,2019-09-13
62,Sizing question on buying men’s for women. Sizing for Nike Graviton sneakers.,"Soo I had been eyeing the women’s Nike Air Max Graviton in white but Nike seems to only sell it in men’s. Normally I’m a size 9 in women US and 7 in men US. Although the last time I bought my women’s Nike TNs a 9.5 was the best fit considering I also have a wide foot. 

I was going to order a 7.5 just to be sure but I have been reading that men’s shoes tend to be wider anyway and have a larger toe box. If so should i just stick to a 7 than a 7.5? Or is the safest best just to get the 7.5?",Nike,1568443108,buzzbuzzbih,3,0,True,2019-09-14
65,Trying to remember a hoodie or shirt Drake wore,"i remember seeing pictures of drake wearing a nike shirt- it was custom done by a company, big embroidered swoosh- i think there were flowers on it too. anyone have any idea what i’m talking about? i can’t remember the brand and google isn’t helping me",Nike,1568486842,perpetualpies,3,0,True,2019-09-14
68,Thankyou to my Nike tanjuns,"http://imgur.com/a/uVOw8g8

They lasted me since 2015. 5 years service as daily trainers including working out. Been wore nearly everyday. Salute.",Nike,1568497739,adeptwarrior,0,0,True,2019-09-14
70,Question?,"I have some air forces with some creases in them, I don’t wear them too often because I don’t want them creased. I tried irons them and it doesn’t work v well, is there a better way to take creases out?",Nike,1568515149,X64Wario,0,0,True,2019-09-14
72,Does anyone have a pair of Metro Plus C II's for sale? 9 or 9.5,"Hi, I've been searching all over for a pair of Nike Metro Plus C II's in size 9 or 9.5. Does anyone have a pair for sale? Preferably from 2008 or 2009? Please let me know! Sorry if I'm breaking any rules by posting this.",Nike,1568519264,DoiliesAplenty,0,0,True,2019-09-14
74,Nike.com gift card ridiculous policies!,"Last year in November I received 2 gift card of $500 HKD from my wife.   I figured it's September now it's time to use it before it expires.  
 

What happened was the shittiest online ordering experience ever.

First, apparently I can't use 2 gift cards at once in the same order.  If I buy a pair of shoes for $1200 I can only use 1 card.  Which means I have to pay $700 to get the pair of shoes I want, and find another $500 worth of product to finish up the last card.

Secondly, I input the gift card information and decided to not place the order at the checkout (ie refresh the page because I couldn't find an option to use 2 cards at once), the next time I entered the card info, it displays I have $0.00 left on the card balance.  Naturally I called customer service and I was told once I input the card information, their system will hold my money for 24 hours regardless I place the order or not.   

When I asked your customer service over the phone what happens when the gift card expires while my fund is being held, she just said unfortunately the fund will be lost.

Someone please verify with me on these information, I would like to know for sure if I was just misinformed by an lazy customer service representative.  Otherwise, this has to be the crappiest gift card system I've ever seen from a large company.",Nike,1568532065,danhoyuen,6,4,True,2019-09-15
78,Air Force 1 Question,"Hi!

&amp;#x200B;

I'm planning on buying Air Force One's and I wanted to ask anybody who already owns them how they feel and whether they'll be suitable to wear while walking/running/exercising.

Also, should I buy a size bigger/smaller/equal to my shoe size?

I'm planning on buying them from the official site, so they'll be new I think.

&amp;#x200B;

Thanks for any help! I really appreciate it :)",Nike,1568564321,Naruto-Sage,4,7,True,2019-09-15
79,Air Max 720 Saturn fix,Does anyone know what can be done about the Nike logo peeling off from 720 Saturn,Nike,1568566148,GhostKidd02,0,1,True,2019-09-15
81,NikeID question,"Would a nikeid user be able to customize a shoe and sell it to me? I don't really know how the whole nikeID thing works or if that's against ToS. If it is allowed and you're willing to do so, please PM me. Thanks!",Nike,1568571061,Tyrequis,1,1,True,2019-09-15
84,NIKE Claim Issue (lost in mail),Received email saying I would receive product voucher in the mail in 10 days and it's been 4 weeks. Support hasn't been able to help. Any Advice?,Nike,1568578756,siriuslyneat,1,0,True,2019-09-15
85,Which sneaker would be best for me,I am an extremely athletic person!(size 11.5-12 men’s) I go running in my schools track a lot but I don’t know what shoe could increase my performance. I have seen how good the traction on the outsole of the Pegasus is but I’m not sure what the technology feels like. I have seen (somewhere on YouTube once) a Nike sneaker that seems like it had a metal or other material plate in the midsole that bounced back after every hit. I can’t remember the name. What is your best pick for a durable running shoe!,Nike,1568582034,BLOCKHEAD13REAL,4,1,True,2019-09-15
86,"Help me, you're my only hope!","Was in the mall today and saw a pair of Nike I really liked. The store was closing and they kinda rushed us out (city gear I think it was) so trying to find these. Had a gold back and a white mid to front with what I think was a black check. It looked a lot like NIKE AIR FORCE 1 07 LV8 2
Yellow but in reverse and gold. Very possible they weren't air force ones at all. Any suggestions?",Nike,1568586802,PM_ME_THEM_CURVES,5,1,True,2019-09-15
90,Recommend me Nike sneakers for autumn weather,,Nike,1568634322,MoreState,3,0,True,2019-09-16
96,Skylon FOG Light bone sizing,I'm a 9 and some youtubers suggest going up 1/2 a size..wyt guys?,Nike,1568660775,Simontheinstigator,1,0,True,2019-09-16
98,Best Nike sneakers for everything,"Af1 lows,odyssey react flyknit 2 or Pegasus 36?I can’t pick out if these three and sorta need help...",Nike,1568671223,one_nike_boy,5,0,True,2019-09-16
99,Legend React 2 Heel Lock Lacing??,"Hi guys,

Just bought a pair of Nike Legend React 2s and I'm having some heel slippage.

I thought I'd thread through the laces in the heel lock lacing holes to find... there are no holes...

I'm not sure what to do.... Do I just make holes in them myself ? Is there something I'm missing??

Thanks in advance!",Nike,1568675975,MissRevivalArmy,0,0,True,2019-09-16
101,Can we ship using Nike branded boxes?,I’m selling snkrs on goat and was wondering if I can ship with the Nike logo brown box,Nike,1568685566,bigballerivan23,2,1,True,2019-09-16
103,Replacing my Kobe 4 Protro insoles,"Is it possible for me to remove the insole with something like Full Length Zoom? If so, where can I get it?",Nike,1568693882,torontogrown,1,0,True,2019-09-17
104,Nike Employee Store,"Longshot here, but I’m going to Portland with my wife for an anniversary trip in a couple weeks. I’d love to have the opportunity to get in to the company/employee store. Any employees willing to hook me up?",Nike,1568739763,pipoisdopebro,1,0,True,2019-09-17
106,Shoe sizing,I have been wearing Nike's Stephen Janoski skate shoes for the past 4 years at a 10.5. I am now getting a pair of air force 1's and a pair of the Nike x Clot Air Max Havens. I was wondering if the sizing still matches and if they are any tips on sizing for these shoes what are they?,Nike,1568752123,kamisamalanasa,0,0,True,2019-09-17
107,"I bought a jacket in a nike store and i want to refund it, i have the receipt and its unworn and unwashed and its been less than 30 dayd since i purchased. Will they refund me?",,Nike,1568752351,IDKBRUH9090,5,0,True,2019-09-17
115,Air Max 97 2017 OG silver bullets,Just curious about the air bubbles. I bought a pair of silver bullets and obviously they won’t cheap. Is it ok/normal for the air bubbles to not be 100% clear? By that I mean they have a very light cloudiness here and there. They’re new and unworn. Was wondering before I started wearing them if anyone had any insight into this? Can provide pics if needed. Thanks,Nike,1568762355,gunghiskhan89,1,0,True,2019-09-17
118,Where can I find these tracksuits?,"https://www.instagram.com/p/Bt_yTlJADuI/
https://www.instagram.com/p/BwPqdrAg1Nw/ (guy on the right)",Nike,1568784322,Gravey4rd,1,1,True,2019-09-18
120,Recommend me please the best running shoes,,Nike,1568792483,EveningEditor1,3,0,True,2019-09-18
128,Nike Returns Policy,"Now the new football (soccer) season has now started I wanted to get a new pair of boots but £200+ is a fee I'd rather not pay. Then i came across the returns policy:
&gt; We design our shoes and gear to help you perform at peak level, so if they're not working exactly right for you, we've got you covered. When you buy on Nike.com, we provide you 30 days from the delivery date to take your Nike or Hurley purchases for a trial run, confidently knowing you can return (or exchange) any item (some exceptions apply) for any reason within 30 days. That even includes custom Nike By You sneakers. No questions asked and no delivery costs for NikePlus Members. And after 30 days, you can still return items if they're unworn and unwashed.

So go ahead, shop with confidence and enjoy your 30-day, risk-free trial.

From my understanding this means that I can buy a pair of boots, train and play in them for 25ish days, return them (most likely not in a resellable condition), receive my refund and buy another new pair, then rinse and repeat for the whole season.

I had a chat with a friend today who said that one of his friends did this last season so he basically had a new pair of boots every month and Nike never stopped him. At face value this would suggest I'm fine to do the same and have new boots each month and return them at the end of that month but I find it hard to believe that Nike won't suspend me from returning items if I continue to buy and return the same item (potentially different CW but still) each month. If I think about it from their perspective, they have no reason not to stop me from doing this; it's not like they're going to lose a customer if they do so, and I'm pushing my luck by doing this so I can't really angry if they do lol.

If you've exploited their returns policy like this or in a similar way please reply with your experiences, whether you've been banned/suspended or warned by Nike or never had an issue, I'm very interested to hear if anyone else has done this. Cheers",Nike,1568843997,owxnw14,2,0,True,2019-09-18
129,Editing a Nike by You order after checkout,It's still in the processing stage - anyone know if its possible to make edits after checkout if it's not in the making stage yet?,Nike,1568844561,bxtcheslikenikes,1,0,True,2019-09-18
135,Women’s to men’s size conversion,Looking to cop the women’s Jordan IV ‘mushroom’ today and hoping someone out there can tell me what size to get in this shoe if I’m a 9.5 men’s 🍄,Nike,1568896491,JarJarBinxxxx,2,0,True,2019-09-19
137,Nike Sweat Shirt for sale Cheap,"saw this Sweatshirt for sale pretty cheap (comparatively) thought I would post it on the forums, if anyones bought it please let me know how it is, Im interested.

 [https://www.ebay.com/itm/401891186893](https://www.ebay.com/itm/401891186893)",Nike,1568914218,TheCarClub,0,0,True,2019-09-19
139,"Nike app settings - is there a way to show the weekly miles, instead of all time miles?","Sorry if this is the wrong sub. I really like the Nike run app, but I wish I was able to view my weekly totals on the main run page instead of just my all-time total. Does anyone know if this is even possible?",Nike,1568930951,fmhds,0,2,True,2019-09-19
140,Nike NYFW,Does anyone know where to find a video of the Nike NYFW with the adapt huaraches cause the styles I saw looked amazing and would like to watch the whole thing.,Nike,1568939624,zychpenguin,0,0,True,2019-09-19
141,Is this model only for girls?,https://sizeer.ro/nike-air-force-1-lv8-3-gs-junior-pantofi-sport-alb-ar7446-100,Nike,1568969479,GioniDep,0,1,True,2019-09-20
144,Tech Fleece Sizing,"Tech fleece is pretty pricey so I just want to make sure of the sizing before I buy. I’m 5’8, 134, and wear size 28-29 jeans. I like my pants to fit fairly skinny, so should I get a small or extra small?",Nike,1568990604,j4our,5,5,True,2019-09-20
145,ID on these nike hats? Please I've been wanting to buy a cap for a while now,"●[1](https://media.karousell.com/media/photos/products/2018/01/11/black_nike_cap_hat_tumblr_grunge_vogue_korean_summer_women_fashion_1515645090_decb9a1e.jpg)

●[2](https://data.whicdn.com/images/281832912/large.jpg)

●[3](http://picture-cdn.wheretoget.it/awiv9u-l-610x610-hat-nike-cap-grunge-soft+grunge-tumblr+outfit-sweater-sweatshirt-black-black+nike+cap-white-baseball+cap-fashion-style-black+white-nike+hat-nike+white+hat-nike+black+white-nike+goa.jpg)

●[4](http://picture-cdn.wheretoget.it/in8ozt-l-610x610-hat-blue-nike-swag-india%20westbrooks-black-blouse.jpg)

●[5](https://i.pinimg.com/736x/dc/62/4e/dc624e7cc468934e064fb035bc54286f--kiss-photo-nike-running.jpg)

●[6](https://66.media.tumblr.com/ee6efde5660515ae912a0f28ed771df2/tumblr_njqitfI3mQ1si6s9go1_500.jpg)

●[7](https://cdn.shopify.com/s/files/1/1332/8049/products/Screen_Shot_2018-09-24_at_1.25.38_PM_1200x1200.png?v=1537810511)

●[8](https://i.pinimg.com/originals/0c/7a/50/0c7a507225de6eaf241ece1a2b6c96dd.jpg)

●[9](http://data.whicdn.com/images/184457035/large.jpg)

I don't understand if they're all the same model or not. Can you please refer to them with the numbers, so it's easier.",Nike,1568998629,ciaotwo,4,0,True,2019-09-20
146,My shoe tag came off. RiP,,Nike,1569010238,DepressedBagel,1,0,True,2019-09-20
147,ID - Women’s Star print running shorts,"In some of the images for the Chicago Marathon gear released yesterday, there are a few models wearing a pair of shorts that are black with white stars on one whole leg and part of the other. Anyone have a link? I can’t find them so I’m thinking they may be part of the marathon collection that hasn’t been released yet. 
Links:

[1](https://www.nike.com/t/vaporknit-womens-running-tank-CdBcM5)

[2 - specifically on the Black color](https://www.nike.com/t/therma-sphere-element-womens-long-sleeve-running-top-wVg7fh)",Nike,1569010419,java_megs,1,5,True,2019-09-20
148,"Am flat footed and I want a pair of vapormax 2019, would my orthotic insoles fit inside of them?",Just wanna know if i'll have a problem with them because of my insoles,Nike,1569021120,SirPugsolot,2,1,True,2019-09-20
150,Are these the same hats? Legacy 91 and Legacy 91 Tech Swoosh,"I was thinking about buying [this](https://www.nike.com/t/legacy-91-adjustable-golf-hat-y1MAwd/892651-010), but then on amazon i found [1](https://www.amazon.com/NIKE-Legacy91-Swoosh-Adjustable-Unisex/dp/B01FYPG91Y/ref=mp_s_a_1_5?keywords=nike+cap&amp;qid=1569025718&amp;sprefix=nike+cap&amp;sr=8-5), [2](https://www.amazon.com/NIKE-Tech-Black-Anthracite-White/dp/B07179Q7F3/ref=mp_s_a_1_5?keywords=nike+cap&amp;qid=1569025655&amp;sprefix=nike+cap&amp;sr=8-5), [3](https://www.amazon.com/NIKE-Tech-Swoosh-Black-White/dp/B003KG04UM/ref=mp_s_a_1_7?keywords=nike+cap&amp;qid=1569025655&amp;sprefix=nike+cap&amp;sr=8-7), [https://www.amazon.com/Nike-Mens-Legacy91-Adjustable-Color/dp/B0148KVLVY/ref=mp_s_a_1_16?keywords=nike+cap&amp;qid=1569025655&amp;sprefix=nike+cap&amp;sr=8-16), plus this [other one](https://www.sportsdirect.com/nike-kappe-legacy-91-tech-368027).

Which one do i eventually buy lol.",Nike,1569026744,ciaotwo,6,0,True,2019-09-20
151,Pegasus or Odyssey react flyknit 2,Looking for a good overall shoe for comfort/running...which is better?(can suggest other options),Nike,1569029065,one_nike_boy,5,0,True,2019-09-20
152,Jordan 1 quality,"So, I am fairly new to the sneaker game, and just got a pair of Jordan 1 from Stockx. I realized that the swoosh on one of them is sort of less quality than the rest with lose leather sticking out all over it, and the tip of the swoosh isn't a smooth line, also has glue stain. Are these something I should expect as normal from future Jordan 1's?

https://i.redd.it/z6g0w54fyun31.png

https://i.redd.it/b489554fyun31.png",Nike,1569033164,24KPureHot,1,0,True,2019-09-20
155,"Does anyone have a photo of the first air monarch? I searched in the entire Internet, did not find",,Nike,1569073093,wnnnc,1,9,True,2019-09-21
158,Air Jordan vs Nike college football,Explain it to me like I’m five. Is the Jordan brand more prestigious than Nike in college football? Teams that get sponsored are the best of the best?,Nike,1569089646,Tora-kun,1,0,True,2019-09-21
159,Went to the company store in Beaverton one time. Found an amazing pair of shoes and would love to get more. Was curious if anyone had a hookup to get back in the company store.,,Nike,1569090141,pewppoo,0,0,True,2019-09-21
161,Hey,"Keep getting code 
C6C4B8AD",Nike,1569104481,kassy_23,0,0,True,2019-09-21
163,Air Jordan 1 Mid vs Air Force 1 High,Is the Air Force 1 High taller on my ankle than the Air Jordan 1 Mid?,Nike,1569109564,ScarzRDT,1,0,True,2019-09-21
164,"Can a 6 footer, 170lbs fit a large sized nike hoodie?",Would it be too long or slightly baggy? Or fit perfectly?,Nike,1569117328,bloombloom37383,11,0,True,2019-09-21
165,I’m a size 8. What Nike socks should I get medium (6-8) or large (8-12),,Nike,1569117439,JordanZeKing,4,0,True,2019-09-21
167,Any Nike Outlet Employees in the Inland Empire/ Ventura County area?,Would like to get in contact. Live right in between the Nike Outlets of these areas and usually pretty far drive for me. Would want to ask any worker there of the supply and whenever they get any good shipments in. Will pay extra for hook ups!,Nike,1569126319,rxrod98,2,0,True,2019-09-22
168,Air Force 1 low utility,Planning on getting the Air Force 1 low utility(the one with mainly white colorway) so can anyone give their reviews of the shoe before getting it,Nike,1569131759,AerialNoScopes,0,0,True,2019-09-22
172,Are these Nike AF1 shoes real?,"I can't find any in this colourway online

https://i.redd.it/rvum7x69w4o31.jpg",Nike,1569153800,HiperSniper13,5,0,True,2019-09-22
178,Nike golf tour help please!,"Does anyone know the Nike Golf line well? What's the difference between Nike Golf Tour Performance, and Nike Golf Tour Premium? I think I read somewhere once that Nike stopped making the Golf Tour line. I've picked up both ""performance"" and ""premium"" items and both feel very high quality and pricey. Does anyone know any details? Is one of these lines what they have the pro golfers wear. Thank you!",Nike,1569187478,NewToSudbury,0,0,True,2019-09-22
184,Nike react presto,Is it a good shoe?,Nike,1569218102,one_nike_boy,1,0,True,2019-09-23
185,What the hell,What the fuck is wrong with you niggers your literally going to support China and fucking towelheads over trump and this country who buys all your territory fuck you!,Nike,1569219934,Neva_Again,1,0,True,2019-09-23
187,Undercover x Nike Dbreak University Red/green/yellow,"&amp;#x200B;

https://i.redd.it/lzhwrbghpbo31.jpg",Nike,1569235653,BST_clubs,0,1,True,2019-09-23
189,Name of this product?,"Anybody got the name of this product or a link to it from the official nike store?

I found this image in the official nike ios app (Mens Store).

I appreciate your help.

&amp;#x200B;

![img](33grshnr1do31)",Nike,1569251818,BTiberius,0,1,True,2019-09-23
190,Nike Velcro swooshes,"I got some AF1’s with Velcro swooshes and I’ve been looking to buy some plain white swooshes, anywhere I can find some?",Nike,1569260296,Fred32Fred32,2,0,True,2019-09-23
192,I’m making a sneaker app. Does anybody want to beta test? - $250 raffle for Sign Up,"Hey guys,

I’m developing a sneakerhead social app called Kickstroid. I’m getting ready to launch the next version of the beta and am looking to expand the beta group. If you’re interested, I’ve just launched the signup page for the beta. **By signing up, you are also entered into a raffle to win $250. Then, anyone who signs up using your auto-generated link gives you another entry into the raffle.** I'm hoping to make this app the best it can be so any support would be greatly appreciated.

[https://kickstroid.com/](https://kickstroid.com/)",Nike,1569263398,JoeMcmillan,3,0,True,2019-09-23
197,looking for swooshes for the af1 swoosh pack,"I just got the black af1s from goat, but they came with the wrong swoosh pack. anyone selling the swooshes from the black ones?",Nike,1569272209,macaroniguap,0,0,True,2019-09-23
198,Is odyssey react flyknit 2 a good shoe?,I’ve been looking at Pegasus for some time but people say those are for people with arch...I’m flat footed and I’m looking for a great overall shoe...is the odyssey react flyknit 2 a good shoe or should I just shooed another shoe?(any suggestions would be welcome),Nike,1569276099,one_nike_boy,10,0,True,2019-09-23
200,Nike Shoe Not Releasing In My Country,"Hello, recently I fell in love with the look of  Air Jordan 1 Retro High OG “First Class Flight’ and I was really hyped about their release on 26, but then I went on the  [https://www.nike.com/ro/launch/?s=upcoming](https://www.nike.com/ro/launch/?s=upcoming)  and I saw that they are not releasing it in my country. So now I wonder, **are they ever gonna release it here** or do I have to go 400 km to Hungary to buy them, what's going on? I don't understand why are they not releasing shoes globally or at least release the same shoe in the whole Europe and not on particular region of Europe, it's a little bit annoying that some country have access on something dope while others get shit, why other countries deserve more empathy than the others  .  ¯\\\_(ツ)\_/¯

###",Nike,1569307685,ethical13,1,0,True,2019-09-24
